date_added,FHRSID,BusinessName,BusinessType,AddressLine1,AddressLine2,AddressLine3,AddressLine4,PostCode,LocalAuthorityName,RatingValue,RatingDate,SchemeType,NewRatingPending,Latitude,Longitude,AddressSingleLine
2026-07-17,1969156,The Caribbean Kitchen,Pub/bar/nightclub,13 Middle Street,Brighton,,,BN1 1AL,Brighton and Hove,AwaitingInspection,,FHRS,False,,,"13 Middle Street, Brighton, BN1 1AL"
2026-07-17,1968793,COVEN: Headquarters,Pub/bar/nightclub,BASEMENT TO FIRST FLOOR 30 OLD COMPTON STREET,,LONDON,,W1D 4UR,Westminster,AwaitingInspection,,FHRS,False,,,"BASEMENT TO FIRST FLOOR 30 OLD COMPTON STREET, LONDON, W1D 4UR"
2026-07-17,1962995,Mr Foggs Market Tavern,Pub/bar/nightclub,27 THE MARKET,COVENT GARDEN,LONDON,,WC2E 8RD,Westminster,AwaitingInspection,,FHRS,False,,,"27 THE MARKET, COVENT GARDEN, LONDON, WC2E 8RD"
2026-07-17,1968796,Prince Arthur Belgravia,Pub/bar/nightclub,11 PIMLICO ROAD,,LONDON,,SW1W 8NA,Westminster,5,2025-01-22,FHRS,False,,,"11 PIMLICO ROAD, LONDON, SW1W 8NA"
2026-07-17,121675,North Manchester Golf Club,Pub/bar/nightclub,Rhodes House North Manchester,Manchester Old Road,Middleton,Manchester,M24 4PE,Rochdale,AwaitingInspection,,FHRS,False,,,"Rhodes House North Manchester, Manchester Old Road, Middleton, Manchester, M24 4PE"
2026-07-17,1894338,Cask,Pub/bar/nightclub,,29 Liverpool Road,Manchester,,M3 4NQ,Manchester,5,2026-06-15,FHRS,False,,,"29 Liverpool Road, Manchester, M3 4NQ"
2026-07-17,1968932,Directors Box,Pub/bar/nightclub,,37 BOOTH STREET,MANCHESTER,,M2 4AA,Manchester,AwaitingInspection,,FHRS,False,,,"37 BOOTH STREET, MANCHESTER, M2 4AA"
2026-07-17,1969018,Katie O'Briens Irish Tavern,Pub/bar/nightclub,,23 PETER STREET,MANCHESTER,,M2 5QJ,Manchester,4,2026-04-24,FHRS,False,,,"23 PETER STREET, MANCHESTER, M2 5QJ"
2026-07-17,1969078,Longsight & District Social Club,Pub/bar/nightclub,,140 Kirkmanshulme Lane,Manchester,,M12 4WB,Manchester,5,2026-06-04,FHRS,False,,,"140 Kirkmanshulme Lane, Manchester, M12 4WB"
2026-07-17,1894309,Manchester Academy,Pub/bar/nightclub,University Of Manchester,Oxford Road,Manchester,,M13 9PR,Manchester,5,2026-06-23,FHRS,False,,,"University Of Manchester, Oxford Road, Manchester, M13 9PR"
2026-07-17,1968967,Spinners Rest,Pub/bar/nightclub,,17 Bengal Street,Manchester,,M4 6AQ,Manchester,AwaitingInspection,,FHRS,False,,,"17 Bengal Street, Manchester, M4 6AQ"
2026-07-17,1969117,The Belle Vue,Pub/bar/nightclub,Terminal 2 Airside,Manchester Airport,Manchester,,M90 1QX,Manchester,AwaitingInspection,,FHRS,False,,,"Terminal 2 Airside, Manchester Airport, Manchester, M90 1QX"
2026-07-17,1968996,The Freemount,Pub/bar/nightclub,,28-30 OLDHAM STREET,MANCHESTER,,M1 1JN,Manchester,AwaitingInspection,,FHRS,False,,,"28-30 OLDHAM STREET, MANCHESTER, M1 1JN"
2026-07-17,1831252,The Orion,Pub/bar/nightclub,,8 Burton Road,Manchester,,M20 3ED,Manchester,5,2026-05-21,FHRS,False,,,"8 Burton Road, Manchester, M20 3ED"
2026-07-18,1969373,Brondanw Arms (Y Ring),Pub/bar/nightclub,Brondanw Arms Hotel,,Llanfrothen,Gwynedd,LL48 6AQ,Gwynedd,AwaitingInspection,,FHRS,False,52.9553260803223,-4.06676912307739,"Brondanw Arms Hotel, Llanfrothen, Gwynedd, LL48 6AQ"
2026-07-18,1969383,Menter y Twr,Pub/bar/nightclub,Tower Hotel Stryd Fawr,,Pwllheli,Gwynedd,LL53 5RR,Gwynedd,AwaitingInspection,,FHRS,False,52.8896522521973,-4.41784715652466,"Tower Hotel Stryd Fawr, Pwllheli, Gwynedd, LL53 5RR"
2026-07-18,1969379,The Cliffs,Pub/bar/nightclub,Cliffs Inn Lôn Bridin,,Morfa Nefyn,Gwynedd,LL53 6BY,Gwynedd,AwaitingInspection,,FHRS,False,52.9357376098633,-4.55670595169067,"Cliffs Inn Lôn Bridin, Morfa Nefyn, Gwynedd, LL53 6BY"
2026-07-18,1969361,The Menai Bar & Hotel,Pub/bar/nightclub,Menai Court Hotel Ffordd Craig Y Don,,Bangor,Gwynedd,LL57 2BG,Gwynedd,5,2026-06-19,FHRS,False,53.2284355163574,-4.13400506973267,"Menai Court Hotel Ffordd Craig Y Don, Bangor, Gwynedd, LL57 2BG"
2026-07-18,1969370,Tu Hwnt i'r Afon Inn,Pub/bar/nightclub,Tu Hwnt I'r Afon Inn,,Rhydyclafdy,Gwynedd,LL53 7YL,Gwynedd,5,2026-07-03,FHRS,False,,,"Tu Hwnt I'r Afon Inn, Rhydyclafdy, Gwynedd, LL53 7YL"
2026-07-18,1969374,Y Bryncynan,Pub/bar/nightclub,Tafarn Bryn Cynan Lôn Uchaf,,Morfa Nefyn,Gwynedd,LL53 6AA,Gwynedd,AwaitingInspection,,FHRS,False,52.9248199462891,-4.53507709503174,"Tafarn Bryn Cynan Lôn Uchaf, Morfa Nefyn, Gwynedd, LL53 6AA"
2026-07-18,1969368,Y Tryfan,Pub/bar/nightclub,Llangollen Vaults Hotel 31 Stryd Fawr,,Bethesda,Gwynedd,LL57 3AN,Gwynedd,AwaitingInspection,,FHRS,False,53.1802597045898,-4.06280899047852,"Llangollen Vaults Hotel 31 Stryd Fawr, Bethesda, Gwynedd, LL57 3AN"
2026-07-18,1969373,Brondanw Arms (Y Ring),Pub/bar/nightclub,Brondanw Arms Hotel,,Llanfrothen,Gwynedd,LL48 6AQ,Gwynedd,AwaitingInspection,,FHRS,False,52.9553260803223,-4.06676912307739,"Brondanw Arms Hotel, Llanfrothen, Gwynedd, LL48 6AQ"
2026-07-18,1969383,Menter y Twr,Pub/bar/nightclub,Tower Hotel Stryd Fawr,,Pwllheli,Gwynedd,LL53 5RR,Gwynedd,AwaitingInspection,,FHRS,False,52.8896522521973,-4.41784715652466,"Tower Hotel Stryd Fawr, Pwllheli, Gwynedd, LL53 5RR"
2026-07-18,1969379,The Cliffs,Pub/bar/nightclub,Cliffs Inn Lôn Bridin,,Morfa Nefyn,Gwynedd,LL53 6BY,Gwynedd,AwaitingInspection,,FHRS,False,52.9357376098633,-4.55670595169067,"Cliffs Inn Lôn Bridin, Morfa Nefyn, Gwynedd, LL53 6BY"
2026-07-18,1969361,The Menai Bar & Hotel,Pub/bar/nightclub,Menai Court Hotel Ffordd Craig Y Don,,Bangor,Gwynedd,LL57 2BG,Gwynedd,5,2026-06-19,FHRS,False,53.2284355163574,-4.13400506973267,"Menai Court Hotel Ffordd Craig Y Don, Bangor, Gwynedd, LL57 2BG"
2026-07-18,1969370,Tu Hwnt i'r Afon Inn,Pub/bar/nightclub,Tu Hwnt I'r Afon Inn,,Rhydyclafdy,Gwynedd,LL53 7YL,Gwynedd,5,2026-07-03,FHRS,False,,,"Tu Hwnt I'r Afon Inn, Rhydyclafdy, Gwynedd, LL53 7YL"
2026-07-18,1969374,Y Bryncynan,Pub/bar/nightclub,Tafarn Bryn Cynan Lôn Uchaf,,Morfa Nefyn,Gwynedd,LL53 6AA,Gwynedd,AwaitingInspection,,FHRS,False,52.9248199462891,-4.53507709503174,"Tafarn Bryn Cynan Lôn Uchaf, Morfa Nefyn, Gwynedd, LL53 6AA"
2026-07-18,1969368,Y Tryfan,Pub/bar/nightclub,Llangollen Vaults Hotel 31 Stryd Fawr,,Bethesda,Gwynedd,LL57 3AN,Gwynedd,AwaitingInspection,,FHRS,False,53.1802597045898,-4.06280899047852,"Llangollen Vaults Hotel 31 Stryd Fawr, Bethesda, Gwynedd, LL57 3AN"
2026-07-18,1969466,Mistley Masonic Hall Club,Pub/bar/nightclub,,,,,,Tendring,AwaitingInspection,,FHRS,False,,,
2026-07-18,1969463,The Pointer Inn,Pub/bar/nightclub,Wivenhoe Road,Alresford,Colchester,Essex,CO7 8AQ,Tendring,AwaitingInspection,,FHRS,False,,,"Wivenhoe Road, Alresford, Colchester, Essex, CO7 8AQ"
2026-07-18,1969467,Ye Olde Swan,Pub/bar/nightclub,15 High Street,Brightlingsea,Colchester,Essex,CO7 0AE,Tendring,AwaitingInspection,,FHRS,False,51.8108587,1.0268712,"15 High Street, Brightlingsea, Colchester, Essex, CO7 0AE"
2026-07-18,1969670,Horn Inn Messingham,Pub/bar/nightclub,The Horn Inn,77 High Street,Messingham,Scunthorpe,DN17 3NU,North Lincolnshire,AwaitingInspection,,FHRS,False,53.5283889770508,-0.653195023536682,"The Horn Inn, 77 High Street, Messingham, Scunthorpe, DN17 3NU"
2026-07-18,1969403,The Spinning Mill,Pub/bar/nightclub,Burnley Road,Colne,Lancashire,,BB8 8LF,Pendle,AwaitingInspection,,FHRS,False,53.8462791442871,-2.19633793830872,"Burnley Road, Colne, Lancashire, BB8 8LF"
2026-07-18,1969647,Shepherd and Dog Inn,Pub/bar/nightclub,Shepherd And Dog,Lower Road,Onehouse,STOWMARKET,IP14 3BX,Mid Suffolk,AwaitingInspection,,FHRS,False,,,"Shepherd And Dog, Lower Road, Onehouse, STOWMARKET, IP14 3BX"
2026-07-18,1969727,Atlas,Pub/bar/nightclub,,187 North Promenade,,Cleethorpes,DN35 8SJ,North East Lincolnshire,AwaitingInspection,,FHRS,False,53.563981,-0.030816,"187 North Promenade, Cleethorpes, DN35 8SJ"
2026-07-18,1969722,Healing and District Social Club,Pub/bar/nightclub,,1-2 Rookery Road,,Healing,DN41 7PS,North East Lincolnshire,5,2026-07-16,FHRS,False,53.57699,-0.167787,"1-2 Rookery Road, Healing, DN41 7PS"
2026-07-18,1969842,The William Chambers,Pub/bar/nightclub,30a Chambers Street,Edinburgh,,,EH1 1HU,Edinburgh (City of),Awaiting Inspection,2026-07-15,FHIS,False,55.9474015,-3.1908464,"30a Chambers Street, Edinburgh, EH1 1HU"
2026-07-18,1970032,Generous Briton,Pub/bar/nightclub,,85 Ashby Road,,Loughborough,LE11 3AB,Charnwood,AwaitingInspection,,FHRS,False,52.772426,-1.217408,"85 Ashby Road, Loughborough, LE11 3AB"
2026-07-18,1966107,The Engine House,Pub/bar/nightclub,32 Queen Street,Exeter,,,EX4 3SR,Exeter City,AwaitingInspection,,FHRS,False,50.7258536,-3.5338177,"32 Queen Street, Exeter, EX4 3SR"
2026-07-18,1970039,The New OD,Pub/bar/nightclub,234  Causeway Green Road,,,Oldbury,B68 8LS,Sandwell,AwaitingInspection,,FHRS,False,52.4830597,-2.0168104,"234  Causeway Green Road, Oldbury, B68 8LS"
2026-07-18,1969623,The Railway Vue,Pub/bar/nightclub,163 Station Road,,Impington,Cambridgeshire,CB24 9NP,South Cambridgeshire,AwaitingInspection,,FHRS,False,52.242592,0.1109156,"163 Station Road, Impington, Cambridgeshire, CB24 9NP"
2026-07-18,647614,Brooke & District Cricket Club,Pub/bar/nightclub,Brooke Cricket Club,Bungay Road,Brooke,Norfolk,NR15 1JL,South Norfolk,5,2026-07-15,FHRS,False,52.540251,1.370376,"Brooke Cricket Club, Bungay Road, Brooke, Norfolk, NR15 1JL"
2026-07-18,1864339,The Academy,Pub/bar/nightclub,52 Great Darkgate Street,,Aberystwyth,,SY23 1DW,Ceredigion,5,2026-07-02,FHRS,False,52.4138893,-4.0864259,"52 Great Darkgate Street, Aberystwyth, SY23 1DW"
2026-07-18,1153474,Wheatsheaf,Pub/bar/nightclub,,1 Stretton Road,Greetham,Oakham,LE15 7NP,Rutland,AwaitingInspection,,FHRS,False,52.7189796,-0.6246978,"1 Stretton Road, Greetham, Oakham, LE15 7NP"
2026-07-18,1864339,The Academy,Pub/bar/nightclub,52 Great Darkgate Street,,Aberystwyth,,SY23 1DW,Ceredigion,5,2026-07-02,FHRS,False,52.4138893,-4.0864259,"52 Great Darkgate Street, Aberystwyth, SY23 1DW"
2026-07-18,1969398,Sidcup Golf Club,Pub/bar/nightclub,Hurst Road,Sidcup,Kent,,DA15 9AW,Bexley,AwaitingInspection,,FHRS,False,51.438426,0.114437,"Hurst Road, Sidcup, Kent, DA15 9AW"
2026-07-18,1969494,London Inn,Pub/bar/nightclub,Molland,South Molton,Devon,,EX36 3NG,North Devon,AwaitingInspection,,FHRS,False,51.0423812866211,-3.70261406898499,"Molland, South Molton, Devon, EX36 3NG"
2026-07-18,1969501,Old Stable Bar,Pub/bar/nightclub,Stables Bar,Stowford Farm Meadows,Berrynarbor,Ilfracombe,EX34 0PW,North Devon,5,2026-07-10,FHRS,False,,,"Stables Bar, Stowford Farm Meadows, Berrynarbor, Ilfracombe, EX34 0PW"
2026-07-18,1969505,Prince of Wales,Pub/bar/nightclub,Prince Of Wales,2 Fore Street,ILFRACOMBE,Devon,EX34 9ED,North Devon,AwaitingInspection,,FHRS,False,,,"Prince Of Wales, 2 Fore Street, ILFRACOMBE, Devon, EX34 9ED"
2026-07-18,1969519,The Masons Arms,Pub/bar/nightclub,Knowstone,South Molton,Devon,,EX36 4RY,North Devon,AwaitingInspection,,FHRS,False,50.9948844909668,-3.67319393157959,"Knowstone, South Molton, Devon, EX36 4RY"
2026-07-18,1969514,The Stags Head Inn,Pub/bar/nightclub,Filleigh,Barnstaple,Devon,,EX32 0RN,North Devon,AwaitingInspection,,FHRS,False,51.0340690612793,-3.88928198814392,"Filleigh, Barnstaple, Devon, EX32 0RN"
2026-07-18,1969580,Hythe Youth Centre,Pub/bar/nightclub,HYTHE YOUTH CENTRE CINQUE PORTS AVENUE,,HYTHE,,CT21 6HS,Folkestone and Hythe,AwaitingInspection,,FHRS,False,51.0685606,1.0778097,"HYTHE YOUTH CENTRE CINQUE PORTS AVENUE, HYTHE, CT21 6HS"
2026-07-18,1969350,Marquis Of Granby,Pub/bar/nightclub,,51 St Thomas Place,Penkhull,Stoke-On-Trent,ST4 7LA,Stoke-On-Trent,AwaitingInspection,,FHRS,False,53.0013649,-2.1961131,"51 St Thomas Place, Penkhull, Stoke-On-Trent, ST4 7LA"
2026-07-18,1969358,The Bench and Bar,Pub/bar/nightclub,,93 Christchurch Street,Fenton,Stoke-On-Trent,ST4 3AJ,Stoke-On-Trent,5,2026-07-15,FHRS,False,52.997394,-2.164821,"93 Christchurch Street, Fenton, Stoke-On-Trent, ST4 3AJ"
2026-07-18,450770,Leighton Town Football Club,Pub/bar/nightclub,Bell Close,Lake Street,Leighton Buzzard,Beds,LU7 1RX,Central Bedfordshire,AwaitingInspection,,FHRS,False,51.9130765,-0.6577119,"Bell Close, Lake Street, Leighton Buzzard, Beds, LU7 1RX"
2026-07-20,1970063,The Royal Albert,Pub/bar/nightclub,115 - 117 Albert Road,Southsea,,,PO5 2SQ,Portsmouth,AwaitingInspection,,FHRS,False,50.7868609,-1.077901,"115 - 117 Albert Road, Southsea, PO5 2SQ"
2026-07-21,1970129,New Inn,Pub/bar/nightclub,New Inn Wrexham Road,Johnstown,Wrexham,,LL14 1NU,Wrexham,5,2026-07-07,FHRS,False,53.0102983,-3.043454,"New Inn Wrexham Road, Johnstown, Wrexham, LL14 1NU"
2026-07-21,1970159,Old Brewery,Pub/bar/nightclub,Unit 6 To 7 The Old Brewery Quarter St Mary Street,Cathays,Cardiff,,CF10 1FG,Caerdydd,AwaitingInspection,,FHRS,False,51.4780987,-3.1766638,"Unit 6 To 7 The Old Brewery Quarter St Mary Street, Cathays, Cardiff, CF10 1FG"
2026-07-21,1970297,The Rawdon Arms,Pub/bar/nightclub,Rawdon Arms,1 Shortheath Road,Moira,Swadlincote,DE12 6AL,North West Leicestershire,AwaitingInspection,,FHRS,True,52.7366342,-1.5348879,"Rawdon Arms, 1 Shortheath Road, Moira, Swadlincote, DE12 6AL"
2026-07-21,1970235,The Claddagh Bar,Pub/bar/nightclub,22-24 Strand Road,,Londonderry,,BT48 7AB,Derry City and Strabane,AwaitingInspection,,FHRS,False,54.9996445,-7.3216363,"22-24 Strand Road, Londonderry, BT48 7AB"
2026-07-21,1744379,Azur,Pub/bar/nightclub,14 Leyland Street,Prescot,Knowsley,,L34 5QP,Knowsley,5,2026-07-17,FHRS,False,53.4297981,-2.8037874,"14 Leyland Street, Prescot, Knowsley, L34 5QP"
2026-07-21,1970207,Five Iron Golf - Broadgate,Pub/bar/nightclub,1 Finsbury Avenue,London,,,EC2M 2PA,City of London Corporation,AwaitingInspection,,FHRS,False,51.519789,-0.084159,"1 Finsbury Avenue, London, EC2M 2PA"
2026-07-21,1970351,The Lydden Bell,Pub/bar/nightclub,The Lydden Bell 81 Canterbury Road,,Lydden,Kent,CT15 7EX,Dover,AwaitingInspection,,FHRS,False,51.1631983,1.232571,"The Lydden Bell 81 Canterbury Road, Lydden, Kent, CT15 7EX"
2026-07-21,1970354,The Sportsman,Pub/bar/nightclub,23 The Street,,Sholden,Kent,CT14 0AL,Dover,AwaitingInspection,,FHRS,True,51.2224669,1.3758706,"23 The Street, Sholden, Kent, CT14 0AL"
2026-07-21,1970356,First Inn Last Out,Pub/bar/nightclub,First In Last Out,27 - 28 Clovelly Road,Bideford,Devon,EX39 3BY,Torridge,AwaitingInspection,,FHRS,False,51.0143896,-4.2136842,"First In Last Out, 27 - 28 Clovelly Road, Bideford, Devon, EX39 3BY"
2026-07-21,1970386,lady hamilton,Pub/bar/nightclub,Lady Hamilton Henley Road,,Neston,Cheshire,CH64 0SG,Cheshire West and Chester,AwaitingInspection,,FHRS,True,53.2829482,-3.0637992,"Lady Hamilton Henley Road, Neston, Cheshire, CH64 0SG"
2026-07-21,1970396,The quayside,Pub/bar/nightclub,The Quayside 129 Witton Street,,Northwich,Cheshire,CW9 5DY,Cheshire West and Chester,AwaitingInspection,,FHRS,False,53.2624557,-2.5080369,"The Quayside 129 Witton Street, Northwich, Cheshire, CW9 5DY"
2026-07-21,1970129,New Inn,Pub/bar/nightclub,New Inn Wrexham Road,Johnstown,Wrexham,,LL14 1NU,Wrecsam,5,2026-07-07,FHRS,False,53.0102983,-3.043454,"New Inn Wrexham Road, Johnstown, Wrexham, LL14 1NU"
2026-07-21,1970409,Sticky Fingers at Samuel Barlow,Pub/bar/nightclub,The Samuel Barlow Alvecote Marina Robeys Lane,,Alvecote,Warwickshire,B78 1AS,North Warwickshire,AwaitingInspection,,FHRS,False,,,"The Samuel Barlow Alvecote Marina Robeys Lane, Alvecote, Warwickshire, B78 1AS"
2026-07-21,1970170,56 Grains Ltd,Pub/bar/nightclub,35 Chatsworth Road,,,Chesterfield,,Chesterfield,AwaitingInspection,,FHRS,False,53.2355852,-1.4397167,"35 Chatsworth Road, Chesterfield"
2026-07-21,1970144,The Rock Inn,Pub/bar/nightclub,Rock Inn 98 John Street,,Porthcawl,Bridgend,CF36 3DT,Bridgend,AwaitingInspection,,FHRS,False,51.4797706604004,-3.70326900482178,"Rock Inn 98 John Street, Porthcawl, Bridgend, CF36 3DT"
2026-07-21,1970144,The Rock Inn,Pub/bar/nightclub,Rock Inn 98 John Street,,Porthcawl,Bridgend,CF36 3DT,Pen-y-bont ar Ogwr,AwaitingInspection,,FHRS,False,51.4797706604004,-3.70326900482178,"Rock Inn 98 John Street, Porthcawl, Bridgend, CF36 3DT"
2026-07-21,1970159,Old Brewery,Pub/bar/nightclub,Unit 6 To 7 The Old Brewery Quarter St Mary Street,Cathays,Cardiff,,CF10 1FG,Cardiff,AwaitingInspection,,FHRS,False,51.4780987,-3.1766638,"Unit 6 To 7 The Old Brewery Quarter St Mary Street, Cathays, Cardiff, CF10 1FG"
2026-07-22,1970618,Melrose Inn,Pub/bar/nightclub,Melrose Inn,The Melrose,Central Drive Shotton,Flintshire,CH5 1LR,Flintshire,AwaitingInspection,,FHRS,False,53.2039996,-3.0392051,"Melrose Inn, The Melrose, Central Drive Shotton, Flintshire, CH5 1LR"
2026-07-22,1970596,Harlow Rock School,Pub/bar/nightclub,Katherines Hatch Common Room,Katherines Hatch,Harlow,Essex,CM19 5NP,Harlow,AwaitingInspection,,FHRS,False,51.7578021,0.0712882,"Katherines Hatch Common Room, Katherines Hatch, Harlow, Essex, CM19 5NP"
2026-07-22,1970618,Melrose Inn,Pub/bar/nightclub,Melrose Inn,The Melrose,Central Drive Shotton,Flintshire,CH5 1LR,Sir y Fflint,AwaitingInspection,,FHRS,False,53.2039996,-3.0392051,"Melrose Inn, The Melrose, Central Drive Shotton, Flintshire, CH5 1LR"
2026-07-22,1630081,Bronte Lounge,Pub/bar/nightclub,3-5 Middlegate,Birstall,Batley,,WF17 9HA,Kirklees,5,2023-09-15,FHRS,False,53.732473,-1.662299,"3-5 Middlegate, Birstall, Batley, WF17 9HA"
2026-07-22,1970636,Outlane Golf Club Ltd,Pub/bar/nightclub,Slack Lane,Outlane,Huddersfield,,HD3 3FQ,Kirklees,5,2026-07-09,FHRS,False,53.649675,-1.878799,"Slack Lane, Outlane, Huddersfield, HD3 3FQ"
2026-07-22,1970688,Kings Oak Hotel (2009) Ltd,Pub/bar/nightclub,Kings Oak Hotel,Pauls Nursery Road,Loughton,Essex,IG10 4AE,Epping Forest,5,2026-02-19,FHRS,False,51.664284,0.039968,"Kings Oak Hotel, Pauls Nursery Road, Loughton, Essex, IG10 4AE"
2026-07-22,1970520,The Pied Bull,Pub/bar/nightclub,Pied Bull,54 High Street,Newton Le Willows,,WA12 9SH,St Helens,5,2026-07-20,FHRS,False,53.4571862,-2.6181744,"Pied Bull, 54 High Street, Newton Le Willows, WA12 9SH"
2026-07-22,1970484,Swan Inn,Pub/bar/nightclub,13 Russell Road,,Rhyl,Denbighshire,LL18 3BS,Denbighshire,AwaitingInspection,,FHRS,False,53.3209800720215,-3.48913407325745,"13 Russell Road, Rhyl, Denbighshire, LL18 3BS"
2026-07-22,1970725,Black Bear Lodge,Pub/bar/nightclub,BLACK BEAR INN HIGH STREET,,,SANDBACH,CW11 1AX,Cheshire East,AwaitingInspection,,FHRS,False,,,"BLACK BEAR INN HIGH STREET, SANDBACH, CW11 1AX"
2026-07-22,1970716,Cheshire cheese,Pub/bar/nightclub,466-468 Crewe Road,Sandbach,,Cheshire East,CW11 3RL,Cheshire East,AwaitingInspection,,FHRS,False,53.1295462,-2.3734843,"466-468 Crewe Road, Sandbach, Cheshire East, CW11 3RL"
2026-07-22,1970726,The Marshfield Bank Farm House,Pub/bar/nightclub,Marshfield Bank Farm Middlewich Road,Woolstanwood,,Cheshire East,CW2 8SD,Cheshire East,AwaitingInspection,,FHRS,False,53.0952477,-2.4868893,"Marshfield Bank Farm Middlewich Road, Woolstanwood, Cheshire East, CW2 8SD"
2026-07-22,1970710,Treble Congleton,Pub/bar/nightclub,38-40 High Street,Congleton,,Cheshire East,CW12 1BD,Cheshire East,AwaitingInspection,,FHRS,False,53.1627093,-2.21191,"38-40 High Street, Congleton, Cheshire East, CW12 1BD"
2026-07-22,286117,Sammys Bar and Kitchen,Pub/bar/nightclub,69-75 Marygate,Berwick-Upon-Tweed,Northumberland,,TD15 1BA,Northumberland,AwaitingInspection,,FHRS,False,55.769996,-2.005062,"69-75 Marygate, Berwick-Upon-Tweed, Northumberland, TD15 1BA"
2026-07-22,1970746,Han Jan,Pub/bar/nightclub,1 High Street,New Malden,,,KT3 4DQ,Kingston-Upon-Thames,AwaitingInspection,,FHRS,False,51.4034449,-0.2572793,"1 High Street, New Malden, KT3 4DQ"
2026-07-22,1970484,Swan Inn,Pub/bar/nightclub,13 Russell Road,,Rhyl,Denbighshire,LL18 3BS,Sir Ddinbych,AwaitingInspection,,FHRS,False,53.3209800720215,-3.48913407325745,"13 Russell Road, Rhyl, Denbighshire, LL18 3BS"
2026-07-22,1970535,Barbarys,Pub/bar/nightclub,15 - 17 Bridge End,Burnley Road,Mytholmroyd,Hebden Bridge,HX7 5DR,Calderdale,AwaitingInspection,,FHRS,False,53.7307782,-1.9834119,"15 - 17 Bridge End, Burnley Road, Mytholmroyd, Hebden Bridge, HX7 5DR"
2026-07-22,1970647,Coaching Inn,Pub/bar/nightclub,The Coaching Inn,Queen Street,South Molton,Devon,EX36 3BJ,North Devon,AwaitingInspection,,FHRS,False,,,"The Coaching Inn, Queen Street, South Molton, Devon, EX36 3BJ"
2026-07-22,1945430,Larkhall Sports Club,Pub/bar/nightclub,Charlcombe Lane,Charlcombe,Bath,Bath And North East Somerset,BA1 8DL,Bath and North East Somerset,5,2026-07-16,FHRS,False,,,"Charlcombe Lane, Charlcombe, Bath, Bath And North East Somerset, BA1 8DL"
2026-07-22,1970462,Halfway House,Pub/bar/nightclub,Willand,Cullompton,Devon,,EX15 2RF,Mid Devon,AwaitingInspection,,FHRS,False,50.89442455,-3.376545,"Willand, Cullompton, Devon, EX15 2RF"
2026-07-22,1721522,Morchard Bishop Sports & Social Club,Pub/bar/nightclub,Wood Lane,Morchard Bishop,Devon,,EX17 6PE,Mid Devon,AwaitingInspection,,FHRS,False,,,"Wood Lane, Morchard Bishop, Devon, EX17 6PE"
2026-07-22,1970488,Ryder's Bar,Pub/bar/nightclub,,1-6 Old Blacksmiths Yard,Sadler Gate,Derby,DE1 3PD,Derby City,5,2026-06-24,FHRS,False,52.9235068,-1.4790539,"1-6 Old Blacksmiths Yard, Sadler Gate, Derby, DE1 3PD"
2026-07-22,1970505,The Royal Telegraph,Pub/bar/nightclub,,73 London Road,Derby,,DE1 2QS,Derby City,AwaitingInspection,,FHRS,False,52.917296,-1.470261,"73 London Road, Derby, DE1 2QS"
2026-07-22,1651607,The Bell,Pub/bar/nightclub,The Bell Inn Green End Road,,Sawtry,Cambridgeshire,PE28 5UY,Huntingdonshire,2,2026-06-11,FHRS,False,,,"The Bell Inn Green End Road, Sawtry, Cambridgeshire, PE28 5UY"
2026-07-22,1970553,The Saracens Head,Pub/bar/nightclub,129 Greys Road,Henley-On-Thames,Oxon,,RG9 1TE,South Oxfordshire,AwaitingInspection,,FHRS,False,51.5334426,-0.9087309,"129 Greys Road, Henley-On-Thames, Oxon, RG9 1TE"
2026-07-23,1971228,The Royal Oak,Pub/bar/nightclub,22 Earlsdon Street,,,Coventry,CV5 6EJ,Coventry,AwaitingInspection,,FHRS,False,52.3994195,-1.5319548,"22 Earlsdon Street, Coventry, CV5 6EJ"
2026-07-23,1971211,The Cockett Inn,Pub/bar/nightclub,,Waunarlwydd Road,,Swansea,SA2 0GB,Swansea,AwaitingInspection,,FHRS,False,51.63077149,-3.98645952,"Waunarlwydd Road, Swansea, SA2 0GB"
2026-07-23,1971213,The Plough and Harrow,Pub/bar/nightclub,,Church Road,,Llansamlet,SA7 9RL,Swansea,AwaitingInspection,,FHRS,False,51.66299014,-3.90118066,"Church Road, Llansamlet, SA7 9RL"
2026-07-23,701971,Builth Wells Cricket Club,Pub/bar/nightclub,Garth Road,Builth Wells,Powys,,LD2 3NH,Powys,AwaitingInspection,,FHRS,False,52.149805,-3.413209,"Garth Road, Builth Wells, Powys, LD2 3NH"
2026-07-23,560142,Knighton Bowling Club,Pub/bar/nightclub,Bowling Green,Church Road,Knighton,Powys,LD7 1DR,Powys,AwaitingInspection,,FHRS,False,52.343861,-3.046746,"Bowling Green, Church Road, Knighton, Powys, LD7 1DR"
2026-07-23,560162,Presteigne Bowling Club,Pub/bar/nightclub,24 Hereford Street,Presteigne,Powys,,LD8 2AS,Powys,AwaitingInspection,,FHRS,False,52.271767,-3.003131,"24 Hereford Street, Presteigne, Powys, LD8 2AS"
2026-07-23,1970894,The Notley Arms,Pub/bar/nightclub,The Notley Arms Inn,Front Street,Monksilver,Taunton,TA4 4JB,Somerset,5,2022-08-18,FHRS,False,,,"The Notley Arms Inn, Front Street, Monksilver, Taunton, TA4 4JB"
2026-07-23,1971141,Wheatsheaf,Pub/bar/nightclub,The Wheatsheaf,28 New Street,Chelmsford,,CM1 1NT,Chelmsford,AwaitingInspection,,FHRS,False,51.7368172,0.4733437,"The Wheatsheaf, 28 New Street, Chelmsford, CM1 1NT"
2026-07-23,701971,Builth Wells Cricket Club,Pub/bar/nightclub,Garth Road,Builth Wells,Powys,,LD2 3NH,Powys,AwaitingInspection,,FHRS,False,52.149805,-3.413209,"Garth Road, Builth Wells, Powys, LD2 3NH"
2026-07-23,560142,Knighton Bowling Club,Pub/bar/nightclub,Bowling Green,Church Road,Knighton,Powys,LD7 1DR,Powys,AwaitingInspection,,FHRS,False,52.343861,-3.046746,"Bowling Green, Church Road, Knighton, Powys, LD7 1DR"
2026-07-23,560162,Presteigne Bowling Club,Pub/bar/nightclub,24 Hereford Street,Presteigne,Powys,,LD8 2AS,Powys,AwaitingInspection,,FHRS,False,52.271767,-3.003131,"24 Hereford Street, Presteigne, Powys, LD8 2AS"
2026-07-23,1970824,The Wheatsheaf Inn,Pub/bar/nightclub,Wheatsheaf Public House,Wolverhampton Road,Laney Green,WOLVERHAMPTON,WV10 7LU,South Staffordshire,AwaitingInspection,,FHRS,False,52.6613512,-2.0592087,"Wheatsheaf Public House, Wolverhampton Road, Laney Green, WOLVERHAMPTON, WV10 7LU"
2026-07-23,1971104,The Chequers Alehouse,Pub/bar/nightclub,The Chequers,164 High Street,Stevenage,Herts,SG1 3LL,Stevenage,AwaitingInspection,,FHRS,False,51.907228,-0.206698,"The Chequers, 164 High Street, Stevenage, Herts, SG1 3LL"
2026-07-23,372499,Archers,Pub/bar/nightclub,194-204 Main Road,Romford,,,RM2 5HA,Havering,4,2025-07-30,FHRS,False,51.586576,0.200866,"194-204 Main Road, Romford, RM2 5HA"
2026-07-23,1943944,Array Restaurant,Pub/bar/nightclub,91 Shepherds Hill,Romford,,,RM3 0NP,Havering,AwaitingInspection,,FHRS,False,51.591543,0.244909,"91 Shepherds Hill, Romford, RM3 0NP"
2026-07-23,372438,Bretons Community Association & Social Club,Pub/bar/nightclub,411 Rainham Road,Rainham,,,RM13 7LP,Havering,5,2025-10-15,FHRS,False,51.542266,0.186079,"411 Rainham Road, Rainham, RM13 7LP"
2026-07-23,1301972,BrewDog Upminster,Pub/bar/nightclub,18 Station Road,Upminster,,,RM14 2UB,Havering,5,2025-06-23,FHRS,False,51.5568265,0.2497915,"18 Station Road, Upminster, RM14 2UB"
2026-07-23,1924335,Crowning Angel,Pub/bar/nightclub,87-89 South Street,Romford,,,RM1 1NX,Havering,AwaitingInspection,,FHRS,False,51.5763974,0.1827797,"87-89 South Street, Romford, RM1 1NX"
2026-07-23,830317,Frankie's Wine Bar,Pub/bar/nightclub,29 Station Lane,Hornchurch,,,RM12 6JL,Havering,5,2024-02-27,FHRS,False,51.560774,0.22103,"29 Station Lane, Hornchurch, RM12 6JL"
2026-07-23,1024887,Gidea Park Micropub,Pub/bar/nightclub,236 Main Road,Romford,,,RM2 5HA,Havering,5,2026-01-28,FHRS,False,51.5865783691406,0.200865998864174,"236 Main Road, Romford, RM2 5HA"
2026-07-23,373870,Harvester Gidea Park,Pub/bar/nightclub,91 Main Road,Romford,,,RM2 5EL,Havering,5,2024-03-18,FHRS,False,51.587024,0.200497,"91 Main Road, Romford, RM2 5EL"
2026-07-23,372711,Hornchurch Conservative Club,Pub/bar/nightclub,25 North Street,Hornchurch,,,RM11 1RS,Havering,5,2024-11-19,FHRS,False,51.563713,0.219687,"25 North Street, Hornchurch, RM11 1RS"
