date_added,FHRSID,BusinessName,BusinessType,AddressLine1,AddressLine2,AddressLine3,AddressLine4,PostCode,LocalAuthorityName,RatingValue,RatingDate,SchemeType,NewRatingPending,Latitude,Longitude,AddressSingleLine
2026-03-17,1924649,The George,Pub/bar/nightclub,29 Windsor Road,Wraysbury,Staines,,TW19 5DE,Windsor and Maidenhead,AwaitingInspection,,FHRS,False,51.4572,-0.559108,"29 Windsor Road, Wraysbury, Staines, TW19 5DE"
2026-03-17,366878,Grazing Harts,Pub/bar/nightclub,The Grazing Harts 29 Greaves Sike Lane,Micklebring,Doncaster,,S66 7RR,Doncaster,1,2025-05-23,FHRS,False,,,"The Grazing Harts 29 Greaves Sike Lane, Micklebring, Doncaster, S66 7RR"
2026-03-17,1924657,The Black Swan,Pub/bar/nightclub,Market Place,,,Leyburn,DL8 5AS,North Yorkshire,AwaitingInspection,,FHRS,False,54.30961514,-1.8294082,"Market Place, Leyburn, DL8 5AS"
2026-03-17,1924659,Vale Of York,Pub/bar/nightclub,Carlton Road 0 Carlton Miniott,North Yorkshire,,YO7 4LX,,North Yorkshire,AwaitingInspection,,FHRS,True,,,"Carlton Road 0 Carlton Miniott, North Yorkshire, YO7 4LX"
2026-03-17,649687,The Greyhound Public House,Pub/bar/nightclub,The Greyhound 1 Ash Street,,Ash,Surrey,GU12 6LA,Guildford,3,2025-12-18,FHRS,False,51.244972,-0.728219,"The Greyhound 1 Ash Street, Ash, Surrey, GU12 6LA"
2026-03-18,1925802,Three Horseshoes,Pub/bar/nightclub,Three Horse Shoes Queen Street,,Bridgend,,CF31 1HU,Bridgend,AwaitingInspection,,FHRS,False,51.5055361,-3.5784554,"Three Horse Shoes Queen Street, Bridgend, CF31 1HU"
2026-03-18,1924865,Abridge Village Hall,Pub/bar/nightclub,London Road,Romford,Lambourne,Essex,RM4 1UU,Epping Forest,AwaitingInspection,,FHRS,False,51.64666857,0.1104851,"London Road, Romford, Lambourne, Essex, RM4 1UU"
2026-03-18,1532113,Loughton Synagogue,Pub/bar/nightclub,Borders Lane,Loughton,Essex,,IG10 1TE,Epping Forest,5,2024-09-25,FHRS,False,51.648811,0.070078,"Borders Lane, Loughton, Essex, IG10 1TE"
2026-03-18,1924867,Mooro's,Pub/bar/nightclub,Mooro's Chigwell Ltd Woolston Hall,Abridge Road,Chigwell,Essex,IG7 6BX,Epping Forest,AwaitingInspection,,FHRS,False,51.641726,0.0939203,"Mooro's Chigwell Ltd Woolston Hall, Abridge Road, Chigwell, Essex, IG7 6BX"
2026-03-18,1924907,Rainbow and Dove,Pub/bar/nightclub,Andrew James Keep Rainbow & Dove,Hastingwood Road,Hastingwood,Essex,CM17 9JX,Epping Forest,AwaitingInspection,,FHRS,False,,,"Andrew James Keep Rainbow & Dove, Hastingwood Road, Hastingwood, Essex, CM17 9JX"
2026-03-18,1924904,The Cock Tavern,Pub/bar/nightclub,218 High Street,Ongar,,,CM5 9AB,Epping Forest,AwaitingInspection,,FHRS,False,51.7055342,0.2456529,"218 High Street, Ongar, CM5 9AB"
2026-03-18,1925858,Myrddin's Tap,Pub/bar/nightclub,Flat 1 Staffordshire House Stryd Yr Eglwys,,Abermaw,Gwynedd,LL42 1EH,Gwynedd,AwaitingInspection,,FHRS,False,52.720135,-4.0514536,"Flat 1 Staffordshire House Stryd Yr Eglwys, Abermaw, Gwynedd, LL42 1EH"
2026-03-18,1925022,10 Courtyard The Custard Factory,Pub/bar/nightclub,Gibb Street,Birmingham,,,B9 4BG,Birmingham,AwaitingInspection,,FHRS,False,,,"Gibb Street, Birmingham, B9 4BG"
2026-03-18,1925136,Bulls head,Pub/bar/nightclub,The Green,Kings Norton,Birmingham,,B38 8RU,Birmingham,AwaitingInspection,,FHRS,False,52.407105,-1.930498,"The Green, Kings Norton, Birmingham, B38 8RU"
2026-03-18,1925135,Chik n Chaat,Pub/bar/nightclub,The Victoria,48 John Bright Street,Birmingham,,B1 1BN,Birmingham,AwaitingInspection,,FHRS,False,52.476567,-1.900913,"The Victoria, 48 John Bright Street, Birmingham, B1 1BN"
2026-03-18,1925086,Isla,Pub/bar/nightclub,1460 Pershore Road,Bournville,Birmingham,,B30 2NT,Birmingham,AwaitingInspection,,FHRS,False,52.4259058,-1.9217413,"1460 Pershore Road, Bournville, Birmingham, B30 2NT"
2026-03-18,1925026,Soho Tavern Mere Green,Pub/bar/nightclub,12 Mere Green Road,Birmingham,,,B75 5BP,Birmingham,AwaitingInspection,,FHRS,False,52.5864219665527,-1.82737004756927,"12 Mere Green Road, Birmingham, B75 5BP"
2026-03-18,1925125,TANG HU LU,Pub/bar/nightclub,142 Hurst Street,Birmingham,,,B5 6RY,Birmingham,AwaitingInspection,,FHRS,False,52.4733066,-1.8949354,"142 Hurst Street, Birmingham, B5 6RY"
2026-03-18,1925103,Waterside Tap,Pub/bar/nightclub,46  Gas Street,Birmingham,,,B1 2JT,Birmingham,AwaitingInspection,,FHRS,False,52.4768589,-1.9094337,"46  Gas Street, Birmingham, B1 2JT"
2026-03-18,1925851,Railway Hotel,Pub/bar/nightclub,The Railway Hotel 1 Plymouth Road,,Penarth,Vale Of Glamorgan,CF64 3DA,Bro Morgannwg,AwaitingInspection,,FHRS,False,51.434116,-3.173414,"The Railway Hotel 1 Plymouth Road, Penarth, Vale Of Glamorgan, CF64 3DA"
2026-03-18,1925849,The Buck,Pub/bar/nightclub,62-66 Holton Road,,Barry,,CF63 4HE,Bro Morgannwg,AwaitingInspection,,FHRS,False,51.4052511,-3.2692736,"62-66 Holton Road, Barry, CF63 4HE"
2026-03-18,1924752,The Tavern,Pub/bar/nightclub,5 Royal Well Place,Cheltenham,Gloucestershire,,GL50 3DN,Cheltenham,AwaitingInspection,,FHRS,False,51.899227,-2.079799,"5 Royal Well Place, Cheltenham, Gloucestershire, GL50 3DN"
2026-03-18,1926032,Penwortham Cricket Club,Pub/bar/nightclub,STREET RECORD,Leyland Road,Penwortham,Lancashire,,South Ribble,AwaitingInspection,,FHRS,False,,,"STREET RECORD, Leyland Road, Penwortham, Lancashire"
2026-03-18,1926031,The Bobbin Mill,Pub/bar/nightclub,Flat 1,The Bobbin Mill,2 Eaton Avenue,Buckshaw Village,PR7 7NA,South Ribble,AwaitingInspection,,FHRS,False,53.6868795,-2.6695632,"Flat 1, The Bobbin Mill, 2 Eaton Avenue, Buckshaw Village, PR7 7NA"
2026-03-18,1925822,New Theatre,Pub/bar/nightclub,The New Theatre Park Place,Cathays,Cardiff,,CF10 3LN,Caerdydd,AwaitingInspection,,FHRS,False,,,"The New Theatre Park Place, Cathays, Cardiff, CF10 3LN"
2026-03-18,1925812,Royal Exchange,Pub/bar/nightclub,The Royal Exchange Hotel Ty-mawr Road,Llandaff North,Cardiff,,CF14 2FQ,Caerdydd,AwaitingInspection,,FHRS,False,51.5084819,-3.2304531,"The Royal Exchange Hotel Ty-mawr Road, Llandaff North, Cardiff, CF14 2FQ"
2026-03-18,1925808,Temple Bar Cardiff,Pub/bar/nightclub,6 High Street,Cathays,Cardiff,,CF10 1AW,Caerdydd,AwaitingInspection,,FHRS,False,51.4809359,-3.1799986,"6 High Street, Cathays, Cardiff, CF10 1AW"
2026-03-18,1924776,Comrades Club,Pub/bar/nightclub,58 Cambridge Street,,Godmanchester,Cambridgeshire,PE29 2AY,Huntingdonshire,AwaitingInspection,,FHRS,False,52.3188,-0.1733,"58 Cambridge Street, Godmanchester, Cambridgeshire, PE29 2AY"
2026-03-18,1925851,Railway Hotel,Pub/bar/nightclub,The Railway Hotel 1 Plymouth Road,,Penarth,Vale Of Glamorgan,CF64 3DA,Vale of Glamorgan,AwaitingInspection,,FHRS,False,51.434116,-3.173414,"The Railway Hotel 1 Plymouth Road, Penarth, Vale Of Glamorgan, CF64 3DA"
2026-03-18,1925849,The Buck,Pub/bar/nightclub,62-66 Holton Road,,Barry,,CF63 4HE,Vale of Glamorgan,AwaitingInspection,,FHRS,False,51.4052511,-3.2692736,"62-66 Holton Road, Barry, CF63 4HE"
2026-03-18,1925822,New Theatre,Pub/bar/nightclub,The New Theatre Park Place,Cathays,Cardiff,,CF10 3LN,Cardiff,AwaitingInspection,,FHRS,False,,,"The New Theatre Park Place, Cathays, Cardiff, CF10 3LN"
2026-03-18,1925812,Royal Exchange,Pub/bar/nightclub,The Royal Exchange Hotel Ty-mawr Road,Llandaff North,Cardiff,,CF14 2FQ,Cardiff,AwaitingInspection,,FHRS,False,51.5084819,-3.2304531,"The Royal Exchange Hotel Ty-mawr Road, Llandaff North, Cardiff, CF14 2FQ"
2026-03-18,1925808,Temple Bar Cardiff,Pub/bar/nightclub,6 High Street,Cathays,Cardiff,,CF10 1AW,Cardiff,AwaitingInspection,,FHRS,False,51.4809359,-3.1799986,"6 High Street, Cathays, Cardiff, CF10 1AW"
2026-03-18,1925858,Myrddin's Tap,Pub/bar/nightclub,Flat 1 Staffordshire House Stryd Yr Eglwys,,Abermaw,Gwynedd,LL42 1EH,Gwynedd,AwaitingInspection,,FHRS,False,52.720135,-4.0514536,"Flat 1 Staffordshire House Stryd Yr Eglwys, Abermaw, Gwynedd, LL42 1EH"
2026-03-18,1926037,The Pepper Mill,Pub/bar/nightclub,Phoenix Park,Phoenix Way,Longton,Stoke-On-Trent,ST3 2JD,Stoke-On-Trent,AwaitingInspection,,FHRS,False,52.991057,-2.144015,"Phoenix Park, Phoenix Way, Longton, Stoke-On-Trent, ST3 2JD"
2026-03-18,1925789,The Pitcairngreen Inn,Pub/bar/nightclub,Pitcairngreen Inn,,Pitcairngreen,Perth,PH1 3LP,Perth and Kinross,Pass,2026-03-12,FHIS,False,,,"Pitcairngreen Inn, Pitcairngreen, Perth, PH1 3LP"
2026-03-18,1924818,Dead Crafty Beer Allerton,Pub/bar/nightclub,97 Allerton Road,,Liverpool,,L18 2DD,Liverpool,AwaitingInspection,,FHRS,False,53.3858968,-2.9078766,"97 Allerton Road, Liverpool, L18 2DD"
2026-03-18,1924820,Lord Nelson,Pub/bar/nightclub,146 East Prescot Road,,Liverpool,,L14 5ND,Liverpool,AwaitingInspection,,FHRS,False,53.4168769,-2.8977482,"146 East Prescot Road, Liverpool, L14 5ND"
2026-03-18,1924979,DOM POLSKI EVENTS LTD,Pub/bar/nightclub,,20 Ashburnham Road,Bedford,,MK40 1DS,Bedford,AwaitingInspection,,FHRS,False,52.13611,-0.478392,"20 Ashburnham Road, Bedford, MK40 1DS"
2026-03-18,1924801,Go Rogue,Pub/bar/nightclub,78 Palmerston Road,Southsea,,,PO5 3PT,Portsmouth,AwaitingInspection,,FHRS,False,50.7841186523438,-1.0891580581665,"78 Palmerston Road, Southsea, PO5 3PT"
2026-03-18,1925802,Three Horseshoes,Pub/bar/nightclub,Three Horse Shoes Queen Street,,Bridgend,,CF31 1HU,Pen-y-bont ar Ogwr,AwaitingInspection,,FHRS,False,51.5055361,-3.5784554,"Three Horse Shoes Queen Street, Bridgend, CF31 1HU"
2026-03-19,1926389,The Royal Oak Blean,Pub/bar/nightclub,140 Blean Common,Blean,Kent,,CT2 9JJ,Canterbury City,AwaitingInspection,,FHRS,False,51.3114561,1.0369965,"140 Blean Common, Blean, Kent, CT2 9JJ"
2026-03-19,1926476,Table Six,Pub/bar/nightclub,6 Water Street,Accrington,Lancashire,,BB5 6PX,Hyndburn,5,2026-03-13,FHRS,False,53.7544349,-2.3625533,"6 Water Street, Accrington, Lancashire, BB5 6PX"
2026-03-19,1926312,The Robin Hood,Pub/bar/nightclub,126 Victoria Street,St Albans,Hertfordshire,,AL1 3TG,St Albans City,AwaitingInspection,,FHRS,False,51.7505137,-0.3307152,"126 Victoria Street, St Albans, Hertfordshire, AL1 3TG"
2026-03-19,1926129,Basement85,Pub/bar/nightclub,Watergate House 85 Watergate Street,,Chester,Cheshire,CH1 2LF,Cheshire West and Chester,AwaitingInspection,,FHRS,False,53.1893789,-2.8961482,"Watergate House 85 Watergate Street, Chester, Cheshire, CH1 2LF"
2026-03-19,1926130,The Malt Shovel,Pub/bar/nightclub,The Malt Shovel 35 Liverpool Road,,Neston,Cheshire,CH64 3RB,Cheshire West and Chester,AwaitingInspection,,FHRS,False,53.2925132,-3.0650118,"The Malt Shovel 35 Liverpool Road, Neston, Cheshire, CH64 3RB"
2026-03-19,1926155,The Royal Oak,Pub/bar/nightclub,The Royal Oak Chester Road,Kelsall,Chester,Cheshire,CW6 0RR,Cheshire West and Chester,AwaitingInspection,,FHRS,False,53.2071354,-2.7210314,"The Royal Oak Chester Road, Kelsall, Chester, Cheshire, CW6 0RR"
2026-03-19,1926399,EP Banqueting,Pub/bar/nightclub,Old Town Hall,High Street,Gravesend,Kent,DA11 0AZ,Gravesham,AwaitingInspection,,FHRS,False,51.443182,0.369776,"Old Town Hall, High Street, Gravesend, Kent, DA11 0AZ"
2026-03-19,1926478,Doyles Bar,Pub/bar/nightclub,,,,,,Solihull,AwaitingInspection,,FHRS,False,,,
2026-03-19,1528788,Kingshurst & District Labour Club,Pub/bar/nightclub,51 Clopton Crescent,Fordbridge,Solihull,,B37 6QU,Solihull,AwaitingInspection,,FHRS,True,52.4864244,-1.7353918,"51 Clopton Crescent, Fordbridge, Solihull, B37 6QU"
2026-03-19,1926341,St Ives,Pub/bar/nightclub,,12 Old Market Street,Neath,Neath Port Talbot,SA11 3NA,Castell-nedd Port Talbot,AwaitingInspection,,FHRS,False,51.66444,-3.80341,"12 Old Market Street, Neath, Neath Port Talbot, SA11 3NA"
2026-03-19,1926367,The Hop Pole Retford,Pub/bar/nightclub,The Hop Pole Inn,96 Welham Road,Retford,Nottinghamshire,DN22 6UG,Bassetlaw,5,2026-03-11,FHRS,False,53.328004,-0.926382,"The Hop Pole Inn, 96 Welham Road, Retford, Nottinghamshire, DN22 6UG"
2026-03-19,1926341,St Ives,Pub/bar/nightclub,,12 Old Market Street,Neath,Neath Port Talbot,SA11 3NA,Neath Port Talbot,AwaitingInspection,,FHRS,False,51.66444,-3.80341,"12 Old Market Street, Neath, Neath Port Talbot, SA11 3NA"
2026-03-19,1926101,The Woolpack,Pub/bar/nightclub,Woolpack Hotel 26 High Street,,Tenterden,,TN30 6AP,Ashford,AwaitingInspection,,FHRS,False,51.0687522,0.6877506,"Woolpack Hotel 26 High Street, Tenterden, TN30 6AP"
2026-03-19,1926296,Slimming World Franchise,Pub/bar/nightclub,,,,,,Tewkesbury,AwaitingInspection,,FHRS,False,,,
2026-03-19,1926301,The Red Lion,Pub/bar/nightclub,Red Lion Inn,Wainlode Hill,Norton,Gloucester,GL2 9LW,Tewkesbury,1,2025-10-20,FHRS,False,51.9309268,-2.2223277,"Red Lion Inn, Wainlode Hill, Norton, Gloucester, GL2 9LW"
2026-03-19,1926365,WELLINGTON BAR AND GRILL,Pub/bar/nightclub,7 Market Square,Wellington,Telford,Telford And Wrekin,TF1 1BP,Telford and Wrekin Council,AwaitingInspection,,FHRS,False,52.7012214,-2.5189078,"7 Market Square, Wellington, Telford, Telford And Wrekin, TF1 1BP"
2026-03-19,1926415,Southwold And Reydon Chinese Take Away,Pub/bar/nightclub,22 Fountain Way,Reydon,Southwold,Suffolk,IP18 6SZ,East Suffolk,AwaitingInspection,,FHRS,False,52.3417033,1.6759631,"22 Fountain Way, Reydon, Southwold, Suffolk, IP18 6SZ"
2026-03-19,1926410,Stanford Arms,Pub/bar/nightclub,94 Stanford Street,Lowestoft,Suffolk,,NR32 2DD,East Suffolk,AwaitingInspection,,FHRS,False,52.4791496,1.7445784,"94 Stanford Street, Lowestoft, Suffolk, NR32 2DD"
2026-03-19,1926406,The Village Maid,Pub/bar/nightclub,71 The Street,Lound,Lowestoft,Suffolk,NR32 5LP,East Suffolk,AwaitingInspection,,FHRS,False,52.532342,1.69125,"71 The Street, Lound, Lowestoft, Suffolk, NR32 5LP"
2026-03-19,1926279,Farquharson's Bar And Kitchen,Pub/bar/nightclub,,2 - 4 Invercauld Road,Braemar,Aberdeenshire,AB35 5YP,Aberdeenshire,Awaiting Inspection,2026-03-17,FHIS,False,57.005704,-3.3989157,"2 - 4 Invercauld Road, Braemar, Aberdeenshire, AB35 5YP"
2026-03-19,1926171,Am Politician,Pub/bar/nightclub,Balla,Isle Of South Uist,Eriskay,,HS8 5JL,Comhairle nan Eilean Siar (Western Isles),Pass,2025-06-11,FHIS,False,,,"Balla, Isle Of South Uist, Eriskay, HS8 5JL"
2026-03-19,1926177,Mc'Neils,Pub/bar/nightclub,13 Cromwell Street,Stornoway,,,HS1 2DA,Comhairle nan Eilean Siar (Western Isles),Pass,2023-12-12,FHIS,False,58.208549,-6.3880348,"13 Cromwell Street, Stornoway, HS1 2DA"
2026-03-19,110779,The Pub,Pub/bar/nightclub,,45 China Street,Lancaster,Lancashire,LA1 1EX,Lancaster City,5,2026-03-10,FHRS,False,54.049186,-2.80342,"45 China Street, Lancaster, Lancashire, LA1 1EX"
2026-03-20,925742,The Nott Bar,Pub/bar/nightclub,The Nottingham Castle Public House,257 Wandsworth Road,London,,SW8 2NB,Lambeth,3,2026-02-05,FHRS,False,51.478763,-0.12865,"The Nottingham Castle Public House, 257 Wandsworth Road, London, SW8 2NB"
2026-03-20,833720,The Mission to Seafarers,Pub/bar/nightclub,,Kinkerdale House,Tees Dock,,TS6 6UD,Redcar and Cleveland,5,2025-04-24,FHRS,False,54.602097,-1.140324,"Kinkerdale House, Tees Dock, TS6 6UD"
2026-03-20,1926550,The Cyprus,Pub/bar/nightclub,48 Chichester Road,South Shields,Tyne & Wear,,NE33 4AF,South Tyneside,AwaitingInspection,,FHRS,False,54.98718,-1.430731,"48 Chichester Road, South Shields, Tyne & Wear, NE33 4AF"
2026-03-20,1926549,The Vigilant,Pub/bar/nightclub,The Vigilant.,165 Sunderland Road,South Shields,Tyne & Wear,NE34 6AE,South Tyneside,AwaitingInspection,,FHRS,False,54.9778408,-1.413391,"The Vigilant., 165 Sunderland Road, South Shields, Tyne & Wear, NE34 6AE"
2026-03-20,1872377,The Saddlers arms,Pub/bar/nightclub,High Street,,Cardigan,,SA43 1LG,Ceredigion,AwaitingInspection,,FHRS,False,,,"High Street, Cardigan, SA43 1LG"
2026-03-20,1872377,The Saddlers arms,Pub/bar/nightclub,High Street,,Cardigan,,SA43 1LG,Ceredigion,AwaitingInspection,,FHRS,False,,,"High Street, Cardigan, SA43 1LG"
2026-03-20,588302,Arrowz Sports Lounge,Pub/bar/nightclub,Goschen Place,,Broxburn,,EH52 5JE,West Lothian,Awaiting Inspection,2026-02-25,FHIS,False,55.9326241,-3.4887677,"Goschen Place, Broxburn, EH52 5JE"
2026-03-20,1926621,Prince of Wales,Pub/bar/nightclub,The Prince Of Wales 98 Morden Road,,Wimbledon,Merton,SW19 3BP,Merton,AwaitingInspection,,FHRS,False,,,"The Prince Of Wales 98 Morden Road, Wimbledon, Merton, SW19 3BP"
2026-03-20,745127,The Roohin Pub,Pub/bar/nightclub,Gorringe Park Hotel 29 London Road,,Tooting,Merton,SW17 9JR,Merton,5,2024-01-05,FHRS,False,51.4194909,-0.1615216,"Gorringe Park Hotel 29 London Road, Tooting, Merton, SW17 9JR"
2026-03-20,486447,The Royal Surrey Pub,Pub/bar/nightclub,The Royal Surrey 1 - 9 Abbotsbury Road,,Morden,Merton,SM4 5LH,Merton,AwaitingInspection,,FHRS,False,51.4028933,-0.1917944,"The Royal Surrey 1 - 9 Abbotsbury Road, Morden, Merton, SM4 5LH"
2026-03-20,701971,Builth Wells Cricket Club,Pub/bar/nightclub,Garth Road,Builth Wells,Powys,,LD2 3NH,Powys,AwaitingInspection,,FHRS,False,52.149805,-3.413209,"Garth Road, Builth Wells, Powys, LD2 3NH"
2026-03-20,1926835,Hogs Inn The Victoria Vaults,Pub/bar/nightclub,15 Broad Street,Newtown,Powys,,SY16 2ND,Powys,5,2026-03-12,FHRS,False,52.5161107,-3.3162381,"15 Broad Street, Newtown, Powys, SY16 2ND"
2026-03-20,560142,Knighton Bowling Club,Pub/bar/nightclub,Bowling Green,Church Road,Knighton,Powys,LD7 1DR,Powys,AwaitingInspection,,FHRS,False,52.343861,-3.046746,"Bowling Green, Church Road, Knighton, Powys, LD7 1DR"
2026-03-20,560162,Presteigne Bowling Club,Pub/bar/nightclub,24 Hereford Street,Presteigne,Powys,,LD8 2AS,Powys,AwaitingInspection,,FHRS,False,52.271767,-3.003131,"24 Hereford Street, Presteigne, Powys, LD8 2AS"
2026-03-20,701971,Builth Wells Cricket Club,Pub/bar/nightclub,Garth Road,Builth Wells,Powys,,LD2 3NH,Powys,AwaitingInspection,,FHRS,False,52.149805,-3.413209,"Garth Road, Builth Wells, Powys, LD2 3NH"
2026-03-20,1926835,Hogs Inn The Victoria Vaults,Pub/bar/nightclub,15 Broad Street,Newtown,Powys,,SY16 2ND,Powys,5,2026-03-12,FHRS,False,52.5161107,-3.3162381,"15 Broad Street, Newtown, Powys, SY16 2ND"
2026-03-20,560142,Knighton Bowling Club,Pub/bar/nightclub,Bowling Green,Church Road,Knighton,Powys,LD7 1DR,Powys,AwaitingInspection,,FHRS,False,52.343861,-3.046746,"Bowling Green, Church Road, Knighton, Powys, LD7 1DR"
2026-03-20,560162,Presteigne Bowling Club,Pub/bar/nightclub,24 Hereford Street,Presteigne,Powys,,LD8 2AS,Powys,AwaitingInspection,,FHRS,False,52.271767,-3.003131,"24 Hereford Street, Presteigne, Powys, LD8 2AS"
2026-03-21,1927017,The Dove,Pub/bar/nightclub,The Dove,48 Downing Drive,Leicester,,LE5 6LH,Leicester City,AwaitingInspection,,FHRS,False,52.626283,-1.058644,"The Dove, 48 Downing Drive, Leicester, LE5 6LH"
2026-03-21,1927042,The Greyhound,Pub/bar/nightclub,The Greyhound Inn,Manchester Road,Barnoldswick,Lancashire,BB18 5PW,Pendle,AwaitingInspection,,FHRS,False,53.9127334,-2.1875874,"The Greyhound Inn, Manchester Road, Barnoldswick, Lancashire, BB18 5PW"
2026-03-21,1926994,Crofters,Pub/bar/nightclub,The Crofters,Holbeck Park Avenue,Barrow-In-Furness,Cumbria,LA13 0RE,Westmorland and Furness,AwaitingInspection,,FHRS,False,54.12178,-3.185273,"The Crofters, Holbeck Park Avenue, Barrow-In-Furness, Cumbria, LA13 0RE"
2026-03-21,1927189,The Tilted Barrel,Pub/bar/nightclub,33 High Street,,,Tipton,DY4 9HU,Sandwell,AwaitingInspection,,FHRS,False,52.5417732,-2.0667744,"33 High Street, Tipton, DY4 9HU"
2026-03-21,1927216,Ravine Social Club,Pub/bar/nightclub,17 Belle Vue Street,Wigan,,,WN5 9HF,Wigan,AwaitingInspection,,FHRS,True,53.535291,-2.6691485,"17 Belle Vue Street, Wigan, WN5 9HF"
2026-03-21,1927248,The Joiners,Pub/bar/nightclub,51 Ballards Lane,,,,N3 1XP,Barnet,AwaitingInspection,,FHRS,False,51.6033068,-0.1915184,"51 Ballards Lane, N3 1XP"
2026-03-21,1927094,Copper Beech,Pub/bar/nightclub,Neasham Road,Darlington,,,DL1 4DH,Darlington,AwaitingInspection,,FHRS,False,54.514561,-1.540656,"Neasham Road, Darlington, DL1 4DH"
2026-03-21,1910050,The Bullers Arms,Pub/bar/nightclub,Bullers Arms,Buller Street,East Looe,Looe,PL13 1AS,Cornwall,5,2026-03-19,FHRS,False,,,"Bullers Arms, Buller Street, East Looe, Looe, PL13 1AS"
2026-03-21,1927143,Empire Lounge,Pub/bar/nightclub,,68a Spital Hill,Sheffield,,S4 7LG,Sheffield,AwaitingInspection,,FHRS,False,53.391253,-1.458338,"68a Spital Hill, Sheffield, S4 7LG"
2026-03-21,1927116,Sheffield Beerworks,Pub/bar/nightclub,,298A Abbeydale Road,Sheffield,,S7 1FL,Sheffield,AwaitingInspection,,FHRS,False,53.3614753,-1.4790151,"298A Abbeydale Road, Sheffield, S7 1FL"
2026-03-21,1926947,The Block & Gasket,Pub/bar/nightclub,Block And Gasket,23 Church Road,Burgess Hill,West Sussex,RH15 9BB,Mid Sussex,AwaitingInspection,,FHRS,False,50.9551454,-0.1299881,"Block And Gasket, 23 Church Road, Burgess Hill, West Sussex, RH15 9BB"
2026-03-21,1926956,The White Horse Inn,Pub/bar/nightclub,White Horse Inn,Albourne Road,Hurstpierpoint,Hassocks,BN6 9SP,Mid Sussex,AwaitingInspection,,FHRS,False,50.9343579,-0.1831109,"White Horse Inn, Albourne Road, Hurstpierpoint, Hassocks, BN6 9SP"
2026-03-21,1926971,Kings Head Syresham,Pub/bar/nightclub,2 Abbey Road,Syresham,,,NN13 5HW,West Northamptonshire,AwaitingInspection,,FHRS,False,52.0683233,-1.0807911,"2 Abbey Road, Syresham, NN13 5HW"
2026-03-21,715679,The Old Kings Head,Pub/bar/nightclub,2 Harbidges Lane,Long Buckby,West Northamptonshire,,NN6 7QL,West Northamptonshire,AwaitingInspection,,FHRS,False,52.3037811,-1.0854393,"2 Harbidges Lane, Long Buckby, West Northamptonshire, NN6 7QL"
2026-03-21,1926974,The Red Lion Evenley,Pub/bar/nightclub,39 The Green,Evenley,,,NN13 5SH,West Northamptonshire,AwaitingInspection,,FHRS,False,52.0078608,-1.1456378,"39 The Green, Evenley, NN13 5SH"
2026-03-21,1927024,Ponthir House Inn,Pub/bar/nightclub,,Caerleon Road,Ponthir,Cwmbran,NP18 1PG,Torfaen,AwaitingInspection,,FHRS,False,,,"Caerleon Road, Ponthir, Cwmbran, NP18 1PG"
2026-03-21,1927060,The Cork & Keg,Pub/bar/nightclub,1 Octavia Buildings,Bridge Of Weir Road,Kilmacolm,,PA13 4AE,Inverclyde,Awaiting Inspection,2026-03-20,FHIS,False,55.8940282,-4.6268167,"1 Octavia Buildings, Bridge Of Weir Road, Kilmacolm, PA13 4AE"
2026-03-21,99128,East Port Bar,Pub/bar/nightclub,East Port Bar 7 East Port Dunfermline Fife,,,,KY12 7JG,Fife,Pass,2026-03-05,FHIS,False,56.071515,-3.458392,"East Port Bar 7 East Port Dunfermline Fife, KY12 7JG"
2026-03-21,1927067,Bishops,Pub/bar/nightclub,19 Killyman Street,Moy,Moy,Co. Tyrone,BT71 7SJ,Mid Ulster,AwaitingInspection,,FHRS,False,54.447574,-6.690372,"19 Killyman Street, Moy, Moy, Co. Tyrone, BT71 7SJ"
2026-03-21,1927157,The Plough,Pub/bar/nightclub,5 Datchworth Green,Datchworth,Hertfordshire,,SG3 6TL,East Hertfordshire,AwaitingInspection,,FHRS,False,51.849496,-0.161603,"5 Datchworth Green, Datchworth, Hertfordshire, SG3 6TL"
2026-03-21,1927155,The White Hart,Pub/bar/nightclub,High Street,Puckeridge,Hertfordshire,,SG11 1RR,East Hertfordshire,5,2026-03-11,FHRS,False,51.893049,0.013921,"High Street, Puckeridge, Hertfordshire, SG11 1RR"
2026-03-21,1926899,The Swale Assembly,Pub/bar/nightclub,76 - 78A,76 High Street,Sittingbourne,Kent,ME10 4PB,Swale,AwaitingInspection,,FHRS,False,51.339993,0.736808,"76 - 78A, 76 High Street, Sittingbourne, Kent, ME10 4PB"
2026-03-21,1927024,Ponthir House Inn,Pub/bar/nightclub,,Caerleon Road,Ponthir,Cwmbran,NP18 1PG,Torfaen,AwaitingInspection,,FHRS,False,,,"Caerleon Road, Ponthir, Cwmbran, NP18 1PG"
2026-03-21,1927279,Crown Inns & Dining,Pub/bar/nightclub,55 High Street,,Linton,Cambridgeshire,CB21 4HS,South Cambridgeshire,AwaitingInspection,,FHRS,False,52.0977023,0.276675,"55 High Street, Linton, Cambridgeshire, CB21 4HS"
2026-03-21,1927075,Rose \& Crown Food,Pub/bar/nightclub,Rose And Crown Food,166 High Street,Eckington,Sheffield,S21 4DR,North East Derbyshire,AwaitingInspection,,FHRS,False,53.3075881,-1.3656446,"Rose And Crown Food, 166 High Street, Eckington, Sheffield, S21 4DR"
2026-03-21,1927288,The Selsey Arms,Pub/bar/nightclub,West Dean,Chichester,West Sussex,,PO18 0QX,Chichester,AwaitingInspection,,FHRS,False,50.905389,-0.781781,"West Dean, Chichester, West Sussex, PO18 0QX"
2026-03-21,532417,Ox & Gate Pub / Real Lahore - CRYSTAL PRO LIMITED,Pub/bar/nightclub,341 Oxgate Lane,London,,,NW2 7HS,Brent,AwaitingInspection,,FHRS,False,51.566912,-0.23338,"341 Oxgate Lane, London, NW2 7HS"
2026-03-21,533502,Spicy Basil Bar & Restaurant,Pub/bar/nightclub,147 Cricklewood Broadway,London,,,NW2 3HY,Brent,AwaitingInspection,,FHRS,False,51.556003,-0.214834,"147 Cricklewood Broadway, London, NW2 3HY"
2026-03-24,1927387,In Vino Veritas,Pub/bar/nightclub,53 Eccleston Street,Prescot,Knowsley,,L34 5QH,Knowsley,5,2026-03-12,FHRS,False,,,"53 Eccleston Street, Prescot, Knowsley, L34 5QH"
2026-03-24,1927742,The Five Bells,Pub/bar/nightclub,Five Bells Inn Front Street,,Ringwould,Kent,CT14 8HP,Dover,AwaitingInspection,,FHRS,False,,,"Five Bells Inn Front Street, Ringwould, Kent, CT14 8HP"
2026-03-24,1927721,The Chequers,Pub/bar/nightclub,2 Market Street,Harlow,Essex,,CM17 0AH,Harlow,5,2026-03-06,FHRS,False,,,"2 Market Street, Harlow, Essex, CM17 0AH"
2026-03-24,1927654,Flint Rugby Club,Pub/bar/nightclub,Flint Rugby Club,Flint RFC,Marsh Lane,Flintshire,CH6 5PJ,Flintshire,AwaitingInspection,,FHRS,False,,,"Flint Rugby Club, Flint RFC, Marsh Lane, Flintshire, CH6 5PJ"
2026-03-24,1927481,Eight Kings,Pub/bar/nightclub,40 Southwell,,Portland,Dorset,DT5 2DP,Dorset,AwaitingInspection,,FHRS,False,,,"40 Southwell, Portland, Dorset, DT5 2DP"
2026-03-24,1927483,Hardys Hophouse,Pub/bar/nightclub,62 St. Thomas Street,,Weymouth,,DT4 8EQ,Dorset,AwaitingInspection,,FHRS,True,,,"62 St. Thomas Street, Weymouth, DT4 8EQ"
2026-03-24,1927471,The Swan Inn,Pub/bar/nightclub,Swan Hotel Market Place,,Sturminster Newton,Dorset,DT10 1AR,Dorset,AwaitingInspection,,FHRS,False,,,"Swan Hotel Market Place, Sturminster Newton, Dorset, DT10 1AR"
2026-03-24,1927529,The Hop Stop,Pub/bar/nightclub,Moores Estate Agents,25 Burton Street,Melton Mowbray,,LE13 1AE,Melton,AwaitingInspection,,FHRS,False,,,"Moores Estate Agents, 25 Burton Street, Melton Mowbray, LE13 1AE"
2026-03-24,1927728,The Port of Call,Pub/bar/nightclub,,3 York Street,Clifton,Bristol,BS8 2YE,Bristol,AwaitingInspection,,FHRS,False,,,"3 York Street, Clifton, Bristol, BS8 2YE"
