date_added,FHRSID,BusinessName,BusinessType,AddressLine1,AddressLine2,AddressLine3,AddressLine4,PostCode,LocalAuthorityName,RatingValue,RatingDate,SchemeType,NewRatingPending,Latitude,Longitude,AddressSingleLine
2026-07-10,1683592,The Somerset Arms,Pub/bar/nightclub,,Victoria Street,Abergavenny,Monmouthshire,NP7 5DT,Sir Fynwy,4,2023-11-28,FHRS,False,51.822838,-3.025104,"Victoria Street, Abergavenny, Monmouthshire, NP7 5DT"
2026-07-10,1090650,The Towpath Inn,Pub/bar/nightclub,The Bridgend Inn,49 Main Road,Gilwern,Abergavenny,NP7 0AU,Sir Fynwy,5,2023-12-08,FHRS,False,51.824941,-3.09406,"The Bridgend Inn, 49 Main Road, Gilwern, Abergavenny, NP7 0AU"
2026-07-10,1638734,Tintern Recreation Centre & Village Hall,Pub/bar/nightclub,Tintern Village Hall,Monmouth Road,Tintern,Chepstow,NP16 6SE,Sir Fynwy,5,2023-07-08,FHRS,False,,,"Tintern Village Hall, Monmouth Road, Tintern, Chepstow, NP16 6SE"
2026-07-10,1644575,Treadam Barn,Pub/bar/nightclub,Treadam Farm,Tre-Adam Lane,Llantilio Crossenny,Abergavenny,NP7 8TA,Sir Fynwy,5,2023-07-25,FHRS,False,51.8354561,-2.9007792,"Treadam Farm, Tre-Adam Lane, Llantilio Crossenny, Abergavenny, NP7 8TA"
2026-07-10,516473,Woodlake Park Golf Club,Pub/bar/nightclub,,Glascoed,Nr Usk,Monmouthshire,NP4 0TE,Sir Fynwy,5,2023-07-12,FHRS,False,51.70104,-2.955944,"Glascoed, Nr Usk, Monmouthshire, NP4 0TE"
2026-07-10,1966159,Eden Barn Ltd,Pub/bar/nightclub,Swaledale House,,Little Musgrave,Kirkby Stephen,CA17 4PQ,Westmorland and Furness,AwaitingInspection,,FHRS,False,,,"Swaledale House, Little Musgrave, Kirkby Stephen, CA17 4PQ"
2026-07-10,307003,Kings Head Hotel,Pub/bar/nightclub,,Bridge Street,Appleby-In-Westmorland,,CA16 6QH,Westmorland and Furness,AwaitingInspection,,FHRS,False,54.577821,-2.490686,"Bridge Street, Appleby-In-Westmorland, CA16 6QH"
2026-07-10,1965985,kabul kitchen,Pub/bar/nightclub,,,,,,Sandwell,AwaitingInspection,,FHRS,False,,,
2026-07-10,1838113,PS Foods at Royal Oak Bar & Grill,Pub/bar/nightclub,7  Dudley Port,,,Tipton,DY4 7PR,Sandwell,AwaitingInspection,,FHRS,False,52.5243511,-2.0475574,"7  Dudley Port, Tipton, DY4 7PR"
2026-07-10,1965982,The Navigation,Pub/bar/nightclub,156 Titford Road,Langley,,Oldbury,B69 4QE,Sandwell,AwaitingInspection,,FHRS,False,,,"156 Titford Road, Langley, Oldbury, B69 4QE"
2026-07-10,1965996,Waggon & Horses,Pub/bar/nightclub,17a Church Street,,,Oldbury,B69 3AD,Sandwell,AwaitingInspection,,FHRS,False,52.504537,-2.0157138,"17a Church Street, Oldbury, B69 3AD"
2026-07-10,245159,Tankard Inn,Pub/bar/nightclub,,Wetherby Road,Rufforth,York,YO23 3QF,York,AwaitingInspection,,FHRS,False,53.957641,-1.196854,"Wetherby Road, Rufforth, York, YO23 3QF"
2026-07-10,1966122,Sinias,Pub/bar/nightclub,23 Denmark Centre,Fowler Street,South Shields,Tyne & Wear,NE33 2LR,South Tyneside,AwaitingInspection,,FHRS,False,54.998433,-1.431291,"23 Denmark Centre, Fowler Street, South Shields, Tyne & Wear, NE33 2LR"
2026-07-10,1966257,DBK Catering LTD @ Lilleshall Hall Golf Club,Pub/bar/nightclub,Lilleshall Hall Golf Club Sheriffhales Drive,,Sheriffhales,Shropshire,TF10 9AS,Shropshire,AwaitingInspection,,FHRS,False,,,"Lilleshall Hall Golf Club Sheriffhales Drive, Sheriffhales, Shropshire, TF10 9AS"
2026-07-10,1966246,Market Hall Tavern,Pub/bar/nightclub,9 Shoplatch,,Shrewsbury,Shropshire,SY1 1HF,Shropshire,AwaitingInspection,,FHRS,False,52.7075449,-2.7554857,"9 Shoplatch, Shrewsbury, Shropshire, SY1 1HF"
2026-07-10,1966091,The Butchers Arms,Pub/bar/nightclub,29A Herne Street,Herne,Kent,,CT6 7HL,Canterbury City,AwaitingInspection,,FHRS,False,51.3503422,1.1334612,"29A Herne Street, Herne, Kent, CT6 7HL"
2026-07-10,1966092,Thomas Becket,Pub/bar/nightclub,21 Best Lane,Canterbury,Kent,,CT1 2JB,Canterbury City,AwaitingInspection,,FHRS,False,51.2802883,1.0797424,"21 Best Lane, Canterbury, Kent, CT1 2JB"
2026-07-10,1966145,BBAR,Pub/bar/nightclub,43 BUCKINGHAM PALACE ROAD,,LONDON,,SW1W 0PP,Westminster,AwaitingInspection,,FHRS,False,51.4981553,-0.1435662,"43 BUCKINGHAM PALACE ROAD, LONDON, SW1W 0PP"
2026-07-10,766870,Caldicot Rugby Football Club,Pub/bar/nightclub,,Longfellow Road,Caldicot,Monmouthshire,NP26 4JW,Monmouthshire,5,2023-07-19,FHRS,False,51.585873,-2.760964,"Longfellow Road, Caldicot, Monmouthshire, NP26 4JW"
2026-07-10,1965936,Clydach Wasps AFC,Pub/bar/nightclub,The Pavilion,Clydach Welfare Ground,Clydach,Abergavenny,NP7 0LR,Monmouthshire,Exempt,,FHRS,False,,,"The Pavilion, Clydach Welfare Ground, Clydach, Abergavenny, NP7 0LR"
2026-07-10,729348,Coach & Horses,Pub/bar/nightclub,The Coach And Horses,41 Cross Street,Abergavenny,Monmouthshire,NP7 5ER,Monmouthshire,5,2026-06-18,FHRS,False,51.8207473754883,-3.01651310920715,"The Coach And Horses, 41 Cross Street, Abergavenny, Monmouthshire, NP7 5ER"
2026-07-10,718563,Cuckoo Camp Soc/Workmans Club,Pub/bar/nightclub,Cuckoo Camp Social Club,Warrage Road,Raglan,Usk,NP15 2LD,Monmouthshire,5,2023-09-13,FHRS,False,51.773705,-2.835979,"Cuckoo Camp Social Club, Warrage Road, Raglan, Usk, NP15 2LD"
2026-07-10,1494250,Great Western Bar & Grill,Pub/bar/nightclub,,24 Station Road,Abergavenny,Monmouthshire,NP7 5HS,Monmouthshire,5,2023-10-05,FHRS,False,51.816411,-3.010451,"24 Station Road, Abergavenny, Monmouthshire, NP7 5HS"
2026-07-10,1683594,Kings Head,Pub/bar/nightclub,,Welsh Street,Chepstow,Monmouthshire,NP16 5LL,Monmouthshire,5,2023-11-23,FHRS,False,51.641099,-2.67735,"Welsh Street, Chepstow, Monmouthshire, NP16 5LL"
2026-07-10,1558231,Mathern Athletic Club,Pub/bar/nightclub,,Lower Wyelands,Mathern,Chepstow Monmouthshire,NP16 6JD,Monmouthshire,Exempt,,FHRS,False,,,"Lower Wyelands, Mathern, Chepstow Monmouthshire, NP16 6JD"
2026-07-10,152091,Measure Inn,Pub/bar/nightclub,,63-65 Newport Road,Caldicot,Monmouthshire,NP26 4BR,Monmouthshire,AwaitingInspection,,FHRS,False,51.589467,-2.7545,"63-65 Newport Road, Caldicot, Monmouthshire, NP26 4BR"
2026-07-10,1224211,Monmouthshire Golf Club,Pub/bar/nightclub,Monmouthshire Golf Club,,Llanfoist,Abergavenny,NP7 9HE,Monmouthshire,5,2023-11-03,FHRS,False,51.8084487915039,-3.0229868888855,"Monmouthshire Golf Club, Llanfoist, Abergavenny, NP7 9HE"
2026-07-10,641511,Sir John Herbert Memorial Hall,Pub/bar/nightclub,,Llanover Social Club,Nr Abergavenny,Monmouthshire,,Monmouthshire,5,2023-09-28,FHRS,False,,,"Llanover Social Club, Nr Abergavenny, Monmouthshire"
2026-07-10,1486532,The Red Hart,Pub/bar/nightclub,Red Hart,,Llanfapley,Abergavenny,NP7 8SN,Monmouthshire,4,2023-10-13,FHRS,False,51.8214019,-2.9205618,"Red Hart, Llanfapley, Abergavenny, NP7 8SN"
2026-07-10,1683592,The Somerset Arms,Pub/bar/nightclub,,Victoria Street,Abergavenny,Monmouthshire,NP7 5DT,Monmouthshire,4,2023-11-28,FHRS,False,51.822838,-3.025104,"Victoria Street, Abergavenny, Monmouthshire, NP7 5DT"
2026-07-10,1090650,The Towpath Inn,Pub/bar/nightclub,The Bridgend Inn,49 Main Road,Gilwern,Abergavenny,NP7 0AU,Monmouthshire,5,2023-12-08,FHRS,False,51.824941,-3.09406,"The Bridgend Inn, 49 Main Road, Gilwern, Abergavenny, NP7 0AU"
2026-07-10,1638734,Tintern Recreation Centre & Village Hall,Pub/bar/nightclub,Tintern Village Hall,Monmouth Road,Tintern,Chepstow,NP16 6SE,Monmouthshire,5,2023-07-08,FHRS,False,,,"Tintern Village Hall, Monmouth Road, Tintern, Chepstow, NP16 6SE"
2026-07-10,1644575,Treadam Barn,Pub/bar/nightclub,Treadam Farm,Tre-Adam Lane,Llantilio Crossenny,Abergavenny,NP7 8TA,Monmouthshire,5,2023-07-25,FHRS,False,51.8354561,-2.9007792,"Treadam Farm, Tre-Adam Lane, Llantilio Crossenny, Abergavenny, NP7 8TA"
2026-07-10,516473,Woodlake Park Golf Club,Pub/bar/nightclub,,Glascoed,Nr Usk,Monmouthshire,NP4 0TE,Monmouthshire,5,2023-07-12,FHRS,False,51.70104,-2.955944,"Glascoed, Nr Usk, Monmouthshire, NP4 0TE"
2026-07-10,1966232,JOLLY POTTERS,Pub/bar/nightclub,Jolly Potters,Crackley Bank,Newcastle Under Lyme,Staffordshire,ST5 7AB,Newcastle-Under-Lyme,AwaitingInspection,,FHRS,True,53.05271,-2.253455,"Jolly Potters, Crackley Bank, Newcastle Under Lyme, Staffordshire, ST5 7AB"
2026-07-11,1966309,The Pilot's Rest,Pub/bar/nightclub,193 High Street,Sheerness,Kent,,ME12 1UJ,Swale,AwaitingInspection,,FHRS,False,51.4370636,0.7649126,"193 High Street, Sheerness, Kent, ME12 1UJ"
2026-07-11,287002,The Elks Head,Pub/bar/nightclub,,Whitfield,Northumberland,,NE47 8HD,Northumberland,AwaitingInspection,,FHRS,False,54.9078254699707,-2.34211182594299,"Whitfield, Northumberland, NE47 8HD"
2026-07-11,1966400,Sir Robert Peel Pub,Pub/bar/nightclub,Sir Robert Peel,50 Jarrom Street,Leicester,,LE2 7DD,Leicester City,AwaitingInspection,,FHRS,False,52.628164,-1.1367977,"Sir Robert Peel, 50 Jarrom Street, Leicester, LE2 7DD"
2026-07-11,1956372,Duel Bars And Club,Pub/bar/nightclub,27 Wote Street,Basingstoke,Hampshire,,,Basingstoke and Deane,AwaitingInspection,,FHRS,True,51.2635542,-1.086208,"27 Wote Street, Basingstoke, Hampshire"
2026-07-11,1947651,The Candover,Pub/bar/nightclub,Alresford Road,Preston Candover,Basingstoke,Hampshire,RG25 2EJ,Basingstoke and Deane,5,2026-06-19,FHRS,False,51.1698989868164,-1.13540601730347,"Alresford Road, Preston Candover, Basingstoke, Hampshire, RG25 2EJ"
2026-07-11,1966499,The Crown,Pub/bar/nightclub,Newbury Road,Kingsclere,Newbury,Hampshire,RG20 5QU,Basingstoke and Deane,AwaitingInspection,,FHRS,False,51.325261,-1.247258,"Newbury Road, Kingsclere, Newbury, Hampshire, RG20 5QU"
2026-07-11,1966578,The Farmers Arms Newbarns,Pub/bar/nightclub,Farmers Arms Newbarns Village,Hollow Lane,Barrow-In-Furness,Cumbria,LA13 9NG,Westmorland and Furness,AwaitingInspection,,FHRS,False,54.12495,-3.209878,"Farmers Arms Newbarns Village, Hollow Lane, Barrow-In-Furness, Cumbria, LA13 9NG"
2026-07-11,1966574,The Railway Inn,Pub/bar/nightclub,,6 London Road,Lindal-In-Furness,Cumbria,LA12 0LL,Westmorland and Furness,AwaitingInspection,,FHRS,False,54.1715399,-3.1498819,"6 London Road, Lindal-In-Furness, Cumbria, LA12 0LL"
2026-07-11,1966460,The Treddy,Pub/bar/nightclub,85 High Street,Gloucester,,,GL1 4SY,Gloucester City,AwaitingInspection,,FHRS,False,51.8549391,-2.2358042,"85 High Street, Gloucester, GL1 4SY"
2026-07-11,1966608,SS9 Bar,Pub/bar/nightclub,149 Leigh Road,Leigh-on-sea,Essex,,SS9 1JF,Southend-On-Sea,AwaitingInspection,,FHRS,False,51.5434788,0.6650874,"149 Leigh Road, Leigh-on-sea, Essex, SS9 1JF"
2026-07-11,1966601,Dartmouth Arms,Pub/bar/nightclub,Snowdon Road,Burnhill Green,WOLVERHAMPTON,,WV6 7HU,South Staffordshire,AwaitingInspection,,FHRS,False,,,"Snowdon Road, Burnhill Green, WOLVERHAMPTON, WV6 7HU"
2026-07-14,1966878,Prince of Wales/Archers Appetite,Pub/bar/nightclub,Prince Of Wales Inn,South Parade,Ossett,,WF5 0EL,Wakefield,AwaitingInspection,,FHRS,False,,,"Prince Of Wales Inn, South Parade, Ossett, WF5 0EL"
2026-07-14,1966890,The New Inn,Pub/bar/nightclub,419 Denby Dale Road East,Durkar,Wakefield,,WF4 3AX,Wakefield,AwaitingInspection,,FHRS,False,53.650482,-1.524329,"419 Denby Dale Road East, Durkar, Wakefield, WF4 3AX"
2026-07-14,1966675,Quart Pot,Pub/bar/nightclub,Runwell Road,Runwell,Wickford,Essex,SS11 7PN,Chelmsford,AwaitingInspection,,FHRS,False,51.622754,0.534367,"Runwell Road, Runwell, Wickford, Essex, SS11 7PN"
2026-07-14,1966950,Anglesey Arms,Pub/bar/nightclub,Anglesey Arms,The Green,Stretton,Burton upon Trent,DE13 0EQ,East Staffordshire,AwaitingInspection,,FHRS,False,52.833553314209,-1.6272360086441,"Anglesey Arms, The Green, Stretton, Burton upon Trent, DE13 0EQ"
2026-07-14,1966666,Heath Hotel,Pub/bar/nightclub,The Heath 2 Whitchurch Road,Gabalfa,Cardiff,,CF14 3LW,Caerdydd,AwaitingInspection,,FHRS,False,51.4989733,-3.184527,"The Heath 2 Whitchurch Road, Gabalfa, Cardiff, CF14 3LW"
2026-07-14,1966665,Om’s Cariad Curry,Pub/bar/nightclub,109 - 111 Clare Road,Grangetown,Cardiff,,CF11 6QR,Caerdydd,AwaitingInspection,,FHRS,False,51.4725816,-3.1863055,"109 - 111 Clare Road, Grangetown, Cardiff, CF11 6QR"
2026-07-14,1966662,The Pear Tree,Pub/bar/nightclub,The Pear Tree Cafe Bar The Globe Centre Wellfield Road,Roath,Cardiff,,CF24 3PE,Caerdydd,AwaitingInspection,,FHRS,False,51.4943506,-3.1655556,"The Pear Tree Cafe Bar The Globe Centre Wellfield Road, Roath, Cardiff, CF24 3PE"
2026-07-14,1946113,Duke of Sussex (Applebys),Pub/bar/nightclub,,255 Alfreton Road,,,NG17 1JN,Ashfield,AwaitingInspection,,FHRS,True,53.1138572692871,-1.2880619764328,"255 Alfreton Road, NG17 1JN"
2026-07-14,1966898,The Engineer,Pub/bar/nightclub,,,,,,St Albans City,AwaitingInspection,,FHRS,True,,,
2026-07-14,1966897,The Lower Red Lion,Pub/bar/nightclub,36 Fishpool Street,St Albans,Hertfordshire,,AL3 4RX,St Albans City,AwaitingInspection,,FHRS,True,51.7517354,-0.3465197,"36 Fishpool Street, St Albans, Hertfordshire, AL3 4RX"
2026-07-14,631049,The Birdhouse,Pub/bar/nightclub,1-2 CASTLE PLACE SHOPPING CENTRE,,TROWBRIDGE,,BA14 8AL,Wiltshire,AwaitingInspection,,FHRS,False,51.3193817,-2.2072191,"1-2 CASTLE PLACE SHOPPING CENTRE, TROWBRIDGE, BA14 8AL"
2026-07-14,214809,Speedwell Rooms,Pub/bar/nightclub,Inkersall Road,,,Chesterfield,S43 3JL,Chesterfield,AwaitingInspection,,FHRS,False,53.2643547058105,-1.3526109457016,"Inkersall Road, Chesterfield, S43 3JL"
2026-07-14,1966666,Heath Hotel,Pub/bar/nightclub,The Heath 2 Whitchurch Road,Gabalfa,Cardiff,,CF14 3LW,Cardiff,AwaitingInspection,,FHRS,False,51.4989733,-3.184527,"The Heath 2 Whitchurch Road, Gabalfa, Cardiff, CF14 3LW"
2026-07-14,1966665,Om’s Cariad Curry,Pub/bar/nightclub,109 - 111 Clare Road,Grangetown,Cardiff,,CF11 6QR,Cardiff,AwaitingInspection,,FHRS,False,51.4725816,-3.1863055,"109 - 111 Clare Road, Grangetown, Cardiff, CF11 6QR"
2026-07-14,1966662,The Pear Tree,Pub/bar/nightclub,The Pear Tree Cafe Bar The Globe Centre Wellfield Road,Roath,Cardiff,,CF24 3PE,Cardiff,AwaitingInspection,,FHRS,False,51.4943506,-3.1655556,"The Pear Tree Cafe Bar The Globe Centre Wellfield Road, Roath, Cardiff, CF24 3PE"
2026-07-15,1962721,Grand Bay,Pub/bar/nightclub,Broadfield Barton,Broadfield,Crawley,West Sussex,,Crawley,AwaitingInspection,,FHRS,False,,,"Broadfield Barton, Broadfield, Crawley, West Sussex"
2026-07-15,1967277,Chalkies Sports Bar,Pub/bar/nightclub,16 CROFT STREET,,CROOK,,DL15 8QF,Durham,AwaitingInspection,,FHRS,False,54.7134992,-1.7479818,"16 CROFT STREET, CROOK, DL15 8QF"
2026-07-15,1967284,Mother Mercy,Pub/bar/nightclub,19 SILVER STREET,,DURHAM,,DH1 3RB,Durham,AwaitingInspection,,FHRS,False,54.7758782,-1.5773834,"19 SILVER STREET, DURHAM, DH1 3RB"
2026-07-15,1967271,New Kings,Pub/bar/nightclub,69 HOPE STREET,,CROOK,,DL15 9HT,Durham,AwaitingInspection,,FHRS,False,54.715779,-1.7466948,"69 HOPE STREET, CROOK, DL15 9HT"
2026-07-15,1967270,The Blue Note Music Bar,Pub/bar/nightclub,GROUND FLOOR 2 STATION ROAD,,CONSETT,,DH8 5RL,Durham,AwaitingInspection,,FHRS,False,54.8517344,-1.8300507,"GROUND FLOOR 2 STATION ROAD, CONSETT, DH8 5RL"
2026-07-15,1966976,The Railway Tavern,Pub/bar/nightclub,King Street,Stanford Le Hope,Essex,,SS17 0HL,Thurrock,AwaitingInspection,,FHRS,False,,,"King Street, Stanford Le Hope, Essex, SS17 0HL"
2026-07-15,1967166,The little ship,Pub/bar/nightclub,9 Victoria Square,,Portland,,DT5 1AL,Dorset,AwaitingInspection,,FHRS,False,50.5628274,-2.4497602,"9 Victoria Square, Portland, DT5 1AL"
2026-07-15,1967230,White Lion Harlaston,Pub/bar/nightclub,White Lion Inn,Main Road,Harlaston,Tamworth,B79 9HT,Lichfield,AwaitingInspection,,FHRS,False,52.6964767,-1.681833,"White Lion Inn, Main Road, Harlaston, Tamworth, B79 9HT"
2026-07-15,1967231,Ye Olde Windmill,Pub/bar/nightclub,Ye Olde Windmill Inn,Windmill Lane,Gentleshaw,Rugeley,WS15 4NF,Lichfield,AwaitingInspection,,FHRS,False,,,"Ye Olde Windmill Inn, Windmill Lane, Gentleshaw, Rugeley, WS15 4NF"
2026-07-15,288094,Taste of Northumberland,Pub/bar/nightclub,Station Road,North Broomhill,Northumberland,,NE65 9UT,Northumberland,AwaitingInspection,,FHRS,False,55.305188,-1.614742,"Station Road, North Broomhill, Northumberland, NE65 9UT"
2026-07-15,1967039,The Bull at Riseley,Pub/bar/nightclub,The Bull,Basingstoke Road,Riseley,,RG7 1QL,Wokingham,AwaitingInspection,,FHRS,False,51.362097,-0.965955,"The Bull, Basingstoke Road, Riseley, RG7 1QL"
2026-07-15,1967234,The HiLight,Pub/bar/nightclub,,,,,,Wandsworth,AwaitingInspection,,FHRS,False,,,
2026-07-15,92712,Station Hotel,Pub/bar/nightclub,Station Hotel,King Street,Clitheroe,Lancashire,BB7 2EU,Ribble Valley,AwaitingInspection,,FHRS,False,53.8732238,-2.393817,"Station Hotel, King Street, Clitheroe, Lancashire, BB7 2EU"
2026-07-15,1967218,Ship Inn Ayr,Pub/bar/nightclub,36 North Harbour Street,Ayr,South Ayrshire,,KA8 8AH,South Ayrshire,Awaiting Inspection,2026-07-10,FHIS,False,55.4673184,-4.6346768,"36 North Harbour Street, Ayr, South Ayrshire, KA8 8AH"
2026-07-16,1968578,Celtic Arms (NORTHOP) Ltd,Pub/bar/nightclub,Celtic Arms (NORTHOP) Ltd,The Celtic Arms Northop Country Park,Northop,Flintshire,CH7 6WA,Flintshire,5,2026-06-19,FHRS,False,,,"Celtic Arms (NORTHOP) Ltd, The Celtic Arms Northop Country Park, Northop, Flintshire, CH7 6WA"
2026-07-16,1968578,Celtic Arms (NORTHOP) Ltd,Pub/bar/nightclub,Celtic Arms (NORTHOP) Ltd,The Celtic Arms Northop Country Park,Northop,Flintshire,CH7 6WA,Sir y Fflint,5,2026-06-19,FHRS,False,,,"Celtic Arms (NORTHOP) Ltd, The Celtic Arms Northop Country Park, Northop, Flintshire, CH7 6WA"
2026-07-16,1968446,Mariners Rest,Pub/bar/nightclub,The Mariners Rest,60 - 62 Rotterdam Road,Lowestoft,Suffolk,NR32 2HA,East Suffolk,AwaitingInspection,,FHRS,False,52.4793189,1.7389504,"The Mariners Rest, 60 - 62 Rotterdam Road, Lowestoft, Suffolk, NR32 2HA"
2026-07-16,1967436,Albion Inn,Pub/bar/nightclub,Albion Inn Albion Place,,Willesborough,,TN24 0BU,Ashford,5,2021-08-24,FHRS,False,,,"Albion Inn Albion Place, Willesborough, TN24 0BU"
2026-07-16,1967692,"B Road Hunting Club Limited, The Stag",Pub/bar/nightclub,Halfway House Canterbury Road,,Challock,,TN25 4BB,Ashford,5,2025-11-05,FHRS,False,51.2211972,0.8790304,"Halfway House Canterbury Road, Challock, TN25 4BB"
2026-07-16,1967818,Beaver Inn,Pub/bar/nightclub,Beaver Inn 322 Beaver Road,,Ashford,,TN23 7SP,Ashford,5,2024-06-28,FHRS,False,51.1363992,0.8645371,"Beaver Inn 322 Beaver Road, Ashford, TN23 7SP"
2026-07-16,1967819,Bell Inn,Pub/bar/nightclub,Bell Inn Bell Lane,,Smarden,,TN27 8PW,Ashford,4,2025-09-24,FHRS,False,51.1552532,0.6724117,"Bell Inn Bell Lane, Smarden, TN27 8PW"
2026-07-16,1967827,Blue Anchor Public House,Pub/bar/nightclub,Blue Anchor Public House Bridge Road,,Brabourne,,TN25 6QQ,Ashford,5,2026-06-04,FHRS,False,51.1245867,0.9702779,"Blue Anchor Public House Bridge Road, Brabourne, TN25 6QQ"
2026-07-16,1967772,Bull Inn,Pub/bar/nightclub,The Bull Inn 1 Regent Street,,Rolvenden,,TN17 4PB,Ashford,4,2026-01-21,FHRS,False,51.0536726,0.6292636,"The Bull Inn 1 Regent Street, Rolvenden, TN17 4PB"
2026-07-16,1968246,Chequers on the Green,Pub/bar/nightclub,The Chequers Inn Ashford Road,,High Halden,,TN26 3LP,Ashford,4,2026-02-25,FHRS,False,51.1038781,0.7129114,"The Chequers Inn Ashford Road, High Halden, TN26 3LP"
2026-07-16,1967876,Dukes Head,Pub/bar/nightclub,Dukes Head The Street,,Hamstreet,,TN26 2HE,Ashford,5,2024-07-09,FHRS,False,51.0650941,0.855157,"Dukes Head The Street, Hamstreet, TN26 2HE"
2026-07-16,1967612,Dur Bar,Pub/bar/nightclub,7 New Street,,Ashford,,TN24 8TN,Ashford,5,2023-06-15,FHRS,False,51.1501338,0.8702182,"7 New Street, Ashford, TN24 8TN"
2026-07-16,1968345,Five Bells,Pub/bar/nightclub,Five Bells The Street,,Brabourne,,TN25 5LP,Ashford,5,2025-09-17,FHRS,False,51.1381898,1.0008448,"Five Bells The Street, Brabourne, TN25 5LP"
2026-07-16,1968010,George Hotel,Pub/bar/nightclub,George Hotel 68 High Street,,Ashford,,TN24 8TB,Ashford,5,2022-06-15,FHRS,False,51.1495071,0.8722707,"George Hotel 68 High Street, Ashford, TN24 8TB"
2026-07-16,1967643,George Inn,Pub/bar/nightclub,George Inn The Street,,Molash,,CT4 8HE,Ashford,5,2025-11-05,FHRS,False,,,"George Inn The Street, Molash, CT4 8HE"
2026-07-16,1967727,Honest Miller,Pub/bar/nightclub,Honest Miller The Street,,Brook,,TN25 5PG,Ashford,5,2023-08-04,FHRS,False,51.163544,0.957592,"Honest Miller The Street, Brook, TN25 5PG"
2026-07-16,1968089,Hooden Smokehouse and Cellar,Pub/bar/nightclub,Hooden Smokehouse and Cellar 24 Silver Hill Road,,Willesborough,,TN24 0NY,Ashford,5,2025-01-10,FHRS,False,51.1441723,0.9053205,"Hooden Smokehouse and Cellar 24 Silver Hill Road, Willesborough, TN24 0NY"
2026-07-16,1968399,J D Wetherspoon County Hotel,Pub/bar/nightclub,The County Hotel 10 High Street,,Ashford,,TN24 8TD,Ashford,5,2025-12-10,FHRS,False,51.1492882,0.8753243,"The County Hotel 10 High Street, Ashford, TN24 8TD"
2026-07-16,1967946,New Chimneys,Pub/bar/nightclub,New Chimneys Bar And Restaurant Loudon Way,,Ashford,,TN23 3JJ,Ashford,5,2026-02-05,FHRS,False,51.1544523,0.8460609,"New Chimneys Bar And Restaurant Loudon Way, Ashford, TN23 3JJ"
2026-07-16,1967683,Old Dairy Tap Room,Pub/bar/nightclub,Unit 2 Tenterden Station Estate Station Road,,Tenterden,,TN30 6HE,Ashford,5,2026-06-12,FHRS,False,51.0708581,0.6855651,"Unit 2 Tenterden Station Estate Station Road, Tenterden, TN30 6HE"
2026-07-16,1967822,Red Lion,Pub/bar/nightclub,Red Lion 12-14 High Street,,Biddenden,,TN27 8AH,Ashford,5,2026-07-09,FHRS,False,51.115162,0.6430023,"Red Lion 12-14 High Street, Biddenden, TN27 8AH"
2026-07-16,1967880,Singleton Barn,Pub/bar/nightclub,The Singleton Barn Public House Tithe Barn Lane,,Singleton,,TN23 4TY,Ashford,5,2025-09-11,FHRS,False,51.1396118,0.8408732,"The Singleton Barn Public House Tithe Barn Lane, Singleton, TN23 4TY"
2026-07-16,1968381,Six Bells,Pub/bar/nightclub,Six Bells Inn Bethersden Road,,Woodchurch,,TN26 3QQ,Ashford,5,2025-09-11,FHRS,False,51.0811948,0.7722535,"Six Bells Inn Bethersden Road, Woodchurch, TN26 3QQ"
2026-07-16,1968206,Star Inn,Pub/bar/nightclub,Star Inn 26-28 East Hill,,Ashford,,TN24 8PA,Ashford,5,2023-03-29,FHRS,False,51.1488614,0.87926431,"Star Inn 26-28 East Hill, Ashford, TN24 8PA"
2026-07-16,1968152,The Alfred Arms,Pub/bar/nightclub,Alfred Arms 17 Newtown Green,,Ashford,,TN24 0PE,Ashford,4,2012-07-19,FHRS,False,51.1374981,0.882338,"Alfred Arms 17 Newtown Green, Ashford, TN24 0PE"
2026-07-16,1968179,The Black Horse,Pub/bar/nightclub,The Black Horse Fiddling Lane,,Brabourne,,TN25 6AP,Ashford,4,2026-02-02,FHRS,False,51.1234008,1.0156213,"The Black Horse Fiddling Lane, Brabourne, TN25 6AP"
2026-07-16,1967707,The Black Lion,Pub/bar/nightclub,The Black Lion 15 The Street,,Appledore,,TN26 2BU,Ashford,4,2026-02-24,FHRS,False,51.0296888,0.7897546,"The Black Lion 15 The Street, Appledore, TN26 2BU"
2026-07-16,1968230,The Bowl Inn,Pub/bar/nightclub,The Bowl Inn Stalisfield Road,,Charing,,TN27 0HG,Ashford,4,2025-07-25,FHRS,False,51.2287367,0.7915736,"The Bowl Inn Stalisfield Road, Charing, TN27 0HG"
2026-07-16,1968203,The Compasses Inn,Pub/bar/nightclub,The Compasses Inn Sole Street,,Crundale,,CT4 7ES,Ashford,5,2026-03-25,FHRS,False,51.2044943,1.0007055,"The Compasses Inn Sole Street, Crundale, CT4 7ES"
2026-07-16,1967940,The Crown,Pub/bar/nightclub,The Crown Ashford Road,St Michaels,Tenterden,,TN30 6DJ,Ashford,5,2026-01-29,FHRS,False,51.084618,0.6915866,"The Crown Ashford Road, St Michaels, Tenterden, TN30 6DJ"
2026-07-16,1967627,The Dering Arms,Pub/bar/nightclub,The Dering Arms The Grove,,Pluckley,,TN27 0RR,Ashford,5,2025-07-18,FHRS,False,51.1575401,0.7467062,"The Dering Arms The Grove, Pluckley, TN27 0RR"
2026-07-16,1967731,The Dog House,Pub/bar/nightclub,4 Evegate Park Grange Station Road,,Smeeth,,TN25 6SX,Ashford,5,2026-03-02,FHRS,False,,,"4 Evegate Park Grange Station Road, Smeeth, TN25 6SX"
2026-07-16,1967709,The Ewe and Lamb,Pub/bar/nightclub,26 Maytham Road,,Rolvenden,,TN17 4NP,Ashford,5,2026-02-20,FHRS,False,51.0415093,0.6425601,"26 Maytham Road, Rolvenden, TN17 4NP"
2026-07-16,1967923,The Farriers Arms,Pub/bar/nightclub,The Farriers Arms Flood Street,,Mersham,,TN25 6NU,Ashford,4,2025-09-17,FHRS,False,,,"The Farriers Arms Flood Street, Mersham, TN25 6NU"
2026-07-16,1968183,The Fat Ox,Pub/bar/nightclub,Fat Ox Inn Ashford Road,St Michaels,Tenterden,,TN30 6BT,Ashford,5,2024-01-23,FHRS,False,51.0794213,0.6954838,"Fat Ox Inn Ashford Road, St Michaels, Tenterden, TN30 6BT"
2026-07-16,1968145,The Ferry Inn,Pub/bar/nightclub,The Ferry Inn Appledore Road,,Stone,,TN30 7JY,Ashford,5,2024-09-24,FHRS,False,51.0261041,0.7681674,"The Ferry Inn Appledore Road, Stone, TN30 7JY"
2026-07-16,1967732,The Fish Inn,Pub/bar/nightclub,The Fish Inn Brookfield Road,,Ashford,,TN23 4EZ,Ashford,5,2025-10-27,FHRS,False,51.1401903,0.853608,"The Fish Inn Brookfield Road, Ashford, TN23 4EZ"
2026-07-16,1967518,The Flying Horse,Pub/bar/nightclub,The Flying Horse Wye Road,,Boughton Aluph,,TN25 4HH,Ashford,5,2025-04-04,FHRS,False,51.1892931,0.8928697,"The Flying Horse Wye Road, Boughton Aluph, TN25 4HH"
2026-07-16,1967708,The George Community Pub,Pub/bar/nightclub,The George Inn The Street,,Bethersden,,TN26 3AG,Ashford,5,2023-09-01,FHRS,False,51.1290444,0.755129,"The George Inn The Street, Bethersden, TN26 3AG"
2026-07-16,1967597,The Locomotive,Pub/bar/nightclub,Locomotive Inn 65-67 Beaver Road,,Ashford,,TN23 7SF,Ashford,5,2025-09-11,FHRS,False,51.1396518,0.8705433,"Locomotive Inn 65-67 Beaver Road, Ashford, TN23 7SF"
2026-07-16,1967452,The New Fox Inn Limited,Pub/bar/nightclub,The Windmill Inn 278 Hythe Road,Willesborough,Ashford,,TN24 0QR,Ashford,5,2026-01-07,FHRS,False,51.1440299,0.8940084,"The Windmill Inn 278 Hythe Road, Willesborough, Ashford, TN24 0QR"
2026-07-16,1968017,The Old Mill,Pub/bar/nightclub,The Old Mill Canterbury Road,,Kennington,,TN25 4DZ,Ashford,5,2026-02-05,FHRS,False,,,"The Old Mill Canterbury Road, Kennington, TN25 4DZ"
2026-07-16,1968165,The Pheasant,Pub/bar/nightclub,Unit 10 Eureka Place Trinity Road,,Boughton Aluph,,TN25 4BY,Ashford,5,2026-01-27,FHRS,False,,,"Unit 10 Eureka Place Trinity Road, Boughton Aluph, TN25 4BY"
2026-07-16,1968268,The Pig & Sty,Pub/bar/nightclub,The Pig and Sty Ashford Road,,Bethersden,,TN26 3LF,Ashford,5,2026-03-18,FHRS,False,,,"The Pig and Sty Ashford Road, Bethersden, TN26 3LF"
